"issuekey","created","storypoint","context","codesnippet","t_Improvement","t_Bug","t_New.Feature","t_Story","c_Core","c_Titanium","c_Security","c_Verification","c_Registry","c_CLI","c_Installer","c_Node.Utilities","c_Documentation","c_Markdown"
"CLI-1046","07/15/2016 06:57:51",5,"Getting the correct module versions from dashboard When Ti SDK 6.0.0 is released, we'll be support a new version of android v8. And because of that, all titanium modules have to be recompiled to support it, and it's not backward compatible.   i.e. ti.facebook v3.X.X works for ti.sdk 6 and newer vs ti.facebook v2.X.X works for ti sdk 5.4.0 and older.    Therefore, the following modules:  Hyperloop, ACA, APM that are downloaded automatically with CLI, has to be smart enough to be able to obtain the right versions when doing appc run or appc new. Its ok to have both versions co-exist in the local machine. And it's also ok that we can't control the developer if he chooses to use a 5.4.0 module on a 6.0.0 project.    Dashboard has recommended that the payload can be expanded to provide different urls for both versions. This will be a cross-team effort.","",1,0,0,0,1,0,0,0,0,0,0,0,0,0
"CLI-1048","07/19/2016 20:11:11",1,"appc switch and appc login org selection should be consistent  h5.Description    Currently {{appc switch}} and {{appc login}} are inconsistent in the style of org selection. They should be consistent in displaying the same information.    {code: title=appc switch}  ? To which organization would you like to switch? (Use arrow keys)  > Accenture Preprod (100000559)    Appcelerator Staff (100000295)    APPTS-5484-developer (100001665)    APPTS-5484-enterprise (100001668)    APPTS-5484-individual (100001666)    APPTS-5484-team (100001667)    APPTS-6045-Chrome (100001594)  (Move up and down to reveal more choices)  ","  ? To which organization would you like to switch? (Use arrow keys)  > Accenture Preprod (100000559)    Appcelerator Staff (100000295)    APPTS-5484-developer (100001665)    APPTS-5484-enterprise (100001668)    APPTS-5484-individual (100001666)    APPTS-5484-team (100001667)    APPTS-6045-Chrome (100001594)  (Move up and down to reveal more choices)    ? Into which organization would you like to login? (Use arrow keys)  > qe_test_org_preprod_team    qe_test_org_preprod_vpc_team    qeTestOrg    RateLimitingDeveloper    ratelimitingEnterprise    RateLimitingIndividual    rdongtest  (Move up and down to reveal more choices)  ",1,0,0,0,1,0,0,0,0,0,0,0,0,0
"CLI-1051","07/22/2016 22:27:33",1,"appc login: Deauthorize message does not include -D flag When using {{appc login}} for the first time on a new machine (or after Deauthorizing one) the CLI will return a message stating the ID of the system being authorized, as well as instructions on how to deauthorize the machine. However the command given to do so is {{appc logout}},  which does not deauthorize the machine.     h2. Steps to Reproduce   1. {{appc login}} to an unauthorized machine / {{appc logout -D}} to deauthorize a machine and then {{appc login}}.  2. Enter credentials.  3. You will be prompted to enter an authorization code, which is sent to your account email.  4. Enter the authorization code.    h2. Expected Result     CLI should return the message ""You can deauthorize this computer by logging out with appc logout *-D*""    h2. Actual Result     CLI returns the message ""You can deauthorize this computer by logging out with appc logout""","",0,0,0,1,1,0,0,0,0,0,0,0,0,0
"CLI-1052","07/25/2016 08:55:21",3,"Fix Jenkins and travis for appc-cli-titanium There's a number of things.  1. Currently the jenkins build is failing because it didn't fulfil the required coverage threshold.  2. While unskipping this unit test https://github.com/appcelerator/appc-cli-titanium/blob/master/test/new_test.js#L217, we realise that travis (and jenkins) will break because it prompts for ""Do you wish to install Hyperloop?"" we may need a flag to suppress this prompt.  3. This configuration is messed up. https://github.com/appcelerator/appc-cli-titanium/blob/master/test/travis_configure.sh#L23 it installs 4.0.0.GA when we should be either installing the latest G.A. version available, or latest master build  4. If we use master branch (6.0.0) it will complain about node version 0.10.x is not supported. which is correct so we should consider changing the CI script to support node 4.x  5. Same issue with jenkins. the ci script is here:  https://github.com/appcelerator/jenkins_dsl/blob/master/jobs/appc_cli_dependencies.groovy","",0,0,0,1,0,1,0,0,0,0,0,0,0,0
"CLI-1054","07/26/2016 10:16:58",3,"Set connection timeout for appc use command *Details:*  {{appc use -o json --full}}  command is not getting timed out if it's unable to get the response.    *To reproduce:*  # Configure invalid proxy server through CLI  Example: {{appc config set proxyServer https://""username:password""@10.10.12.13:4567}}  # Run {{appc use -o json --full}} command    *Actual:*  It's waiting for indefinite time and command is not returning at all.    *Expected*  As we provided invalid proxyServer, it should timeout after 10sec    ","",0,1,0,0,1,0,0,0,0,0,0,0,0,0
"CLI-1065","08/02/2016 05:20:40",5,"CLI doesn't relay the error message to Studio when login failed Studio and CLI will exchange the data in the form of json format through socket connection.    If a trial plan is expired, studio is keep asking for login credential without showing what was wrong with the credentials. As studio depends on CLI for login, CLI should return the error message as part of the socket communication message protocol.    For example:  *CLI request for login prompt:*  {code:json}  {""type"":""question"",""question"":[{""type"":""input"",""name"":""username"",""message"":""Appcelerator ID:""},{""type"":""password"",""name"":""password"",""message"":""Password:""}]}      If the password is wrong or it was unable to login due to some other issue(ex: trial account expired),CLI should also send the error message.    *Here is my proposal for expected response:*  {code:json}  {""type"":""question"",""question"":[{""type"":""input"",""name"":""username"",""message"":""Appcelerator ID:""},{""type"":""password"",""name"":""password"",""message"":""Password:""}], ""errormessage"":""Unable to login, your trial plan is expired. Renew your subscription today!""}  {code}","  {""type"":""question"",""question"":[{""type"":""input"",""name"":""username"",""message"":""Appcelerator ID:""},{""type"":""password"",""name"":""password"",""message"":""Password:""}]}    {""username"":""test@appcelerator.com"",""password"":""test1234""}    {""type"":""question"",""question"":[{""type"":""input"",""name"":""username"",""message"":""Appcelerator ID:""},{""type"":""password"",""name"":""password"",""message"":""Password:""}], ""errormessage"":""Unable to login, your trial plan is expired. Renew your subscription today!""}  ",1,0,0,0,1,0,0,0,0,0,0,0,0,0
"CLI-1068","08/03/2016 23:55:18",3,"Windows: A iPhone module folder is downloaded for Windows OS h4. Description  A iPhone folder containing {{com.appcelerator.apm}} and {{hyperloop}} module is downloaded for Windows OS.  h4. Steps to reproduce:  # {{appc new}} create an application with Hyperloop enabled, this will download Hyperloop.  # Navigate to {{C:\ProgramData\Titanium\modules\iphone}}    h4. Actual  The iPhone folder containing {{com.appcelerator.apm}} and {{hyperloop}} is present.    h4. Expected  There should be no iPhone folder on Windows OS","",0,1,0,0,1,0,0,0,0,0,0,0,0,0
"CLI-1066","08/04/2016 00:10:47",5,"Hyperloop: If you have an older version of Hyperloop in your module global space, you cannot get the newer Hyperloop version *Details:* If you have an older version of Hyperloop in your module global space, you cannot get the newer Hyperloop version.    *Notes:* To workaround this issue, you will need to remove both (Android and iOS) Hyperloop modules from the global space.    *Steps to reproduce:*  # In your global module space, {{~/Library/Application Support/Titanium/modules}} or {{C:\ProgramData\Titanium\modules}}, rename your Hyperloop module version to an older version e.g. {{modules/android/hyperloop/1.2.5}} -> {{modules/android/hyperloop/1.2.4}}.  # On Mac, you should remove {{modules/iphone/hyperloop/<ver>}} folder.  # Get the latest Hyperloop module via {{appc new}}; go through all the prompts  # Check your module global space again    *Actual:* The latest Hyperloop module is not downloaded.  *Expected:* The newest Hyperloop module should be downloaded if you have an older version of it.","",0,1,0,0,1,0,0,0,0,0,0,0,0,0
"CLI-1067","08/04/2016 00:45:45",5,"We don't see ""Would you like to enable hyperloop for the app"" prompt while enabling services for new app h5.Steps To Reproduce:  1. Create a new project in appc studio.  2. Fill in all the necessary details in the ""New mobile app project"" dialog.  3. Make sure you have ""Enable appcelerator platform services"" enabled.  4. Click next & then finish.    h5.Actual Results:  1. We do not get the ""Would you like to enable hyperloop for this app"" prompt.  2. Hyperloop is enabled & the module is included in the project default.  *NOTE*: CLI prompts you if you would like to enable hyperloop for the app.    h5.Expected Result:  1. We should get a prompt ""Would you like to enable hyperloop for this app"".   ","",0,1,0,0,1,0,0,0,0,0,0,0,0,0
"CLI-1069","08/05/2016 10:26:57",5,"Install hyperloop module directly through CLI command *Current behaviour:*  While creating a new project CLI identifies whether it's required to install or update the hyperloop module based on the selected SDK version.      *CLI way to update Hyperloop:*  # Find the selected SDK  # Fetch {{api/v2/downloads}} from 360 dashboard  # Identify what version is installed in the system  # Identify what is available on the dashboard 360  # If required to install - download the zip, identify folders based on the OS(for example for windows we shouldn't install iOS module) and extract to the target location.    *Appcelerator Studio way to update Hyperloop:*  Repeat above steps 1-5 again in Java    Can we do something like this to avoid duplicate effort and also to maintain the consistency across the tooling (studio/CLI)        This command will follow the above steps and install the appropriate Hyperloop module    Studio will also use the same command to install the Hyperloop.     ","  appc install --module hyperloop  ",0,0,1,0,1,0,0,0,0,0,0,0,0,0
"CLI-1075","08/10/2016 06:03:12",5,"Unable to configure which IP should the LiveView use h4. Problem Description  When your windows machine has several network adapters (either physical or virtual) you can't configure the LiveView to use certain IP.     In this case, I have two IPs, one internal for Virtual Box and other external connecting with the Wifi Access Point. For testing liveview with genymotion, I would like to use the internal, when using a device, it should be using the external network adapter (wifi).     Any suggestion on how to modify the liveview IP is more than welcomed. ","",0,0,1,0,1,0,0,0,0,0,0,0,0,0
"CLI-1077","08/12/2016 15:38:32",3,"CLI outputting non-JSON warning to Studio While doing some Studio work, I saw that the CLI is spitting out warning text in it;s output, when it's being invoked by Studio (presumably with some command asking for JSON output). Since the warning test is not JSON, Studio's parsing breaks:    ","  You are attempting to run appc 5.4.0 which was compiled for node v5.12.0 but you are now running node v5.10.0  Rebuilding package modules ...  Package modules rebuilt!    {   ""activeSDK"": ""6.0.0.v20160811221444"",   ""defaultInstallLocation"": ""/Users/cwilliams/Library/Application Support/Titanium"",   ""installLocations"": [    ""/Users/cwilliams/Library/Application Support/Titanium"",    ""/Library/Application Support/Titanium""   ],   ""installed"": {  // rest of JSON snipped ...  ",0,1,0,0,0,1,0,0,0,0,0,0,0,0
"CLI-1085","08/16/2016 00:13:18",3,"limit the size of a symbol file uploaded to crashserver to 250Mb in CRASH-65 we limit the size of a symbol file that can be uploaded to the crashserver to 250Mb. this is based on discussions that incorporate competing products and the likely size of a symbol file in the near future weighed against the requirements to support large files.    Ideally, the Studio and CLI components should also prevent anything larger than 250Mb from even being posted to the server. This can allow the user to know about the limitation as well.    ","",0,0,0,1,0,1,0,0,0,0,0,0,0,0
"CLI-1079","08/18/2016 00:22:09",1,"Modules and plugins are not overwritten if the files already exist Hyperloop plugin is picked to illustrate the issue, but this should be reproducible with any modules, plugins or components.    *Steps to reproduce*  1. Make sure Hyperloop plugin is installed  2. Modify {{../plugins/hyperloop/package.json}} to a different version, i.e 1.1.1  3. Do {{appc config set lastUpdateCheckTiDownloads null}} or remove Hyperloop module folder to trigger an update  4. Do {{appc new}}     *Actual Results*  Once the project is created, verify that {{../plugins/hyperloop/package.json}} is not updated.    *Expected Results*  The Hyperloop plugin should be updated .","",0,1,0,0,1,0,0,0,0,0,0,0,0,0
"CLI-1080","08/22/2016 12:39:29",3,"'SyntaxError: Unexpected end of input' on appc use --prerelease h5.Description    When I ran {{appc use --prerelease}} I got the following error, I can't reproduce this, error comes from [this line|https://github.com/appcelerator/appc-install/blob/master/lib/util.js#L605],     *Notes*  After this I checked whether http://software-preprod.cloud.appctest.com/ was up, it was but I was met with [this|https://github.com/appcelerator/appc-registry-server/blob/master/web/views/index.hbs#L55], both issues appear related to me, maybe to do with caching registry side? I ran this command around 12:30 BST 22/08/2016 incase that is useful for any logging        h5.Steps to reproduce  *This steps probably won't reproduce the error, but are what I did*    # run {{appc use --prerelease}}    h5.Actual result    You will get the error above    h5.Expected result    You should not get an error","  C:\Users\Ewan>appc use --prerelease  -undefined:1        SyntaxError: Unexpected end of input      at Object.parse (native)      at IncomingMessage.<anonymous> (C:\Users\Ewan\AppData\Roaming\npm\node_modules\appcelerator\lib\util.js:605:25)      at emitNone (events.js:72:20)      at IncomingMessage.emit (events.js:166:7)      at endReadableNT (_stream_readable.js:921:12)      at nextTickCallbackWith2Args (node.js:442:9)      at process._tickCallback (node.js:356:17)  ",0,1,0,0,1,0,0,0,0,0,0,0,0,0
"CLI-1081","08/22/2016 19:14:45",1,"Modules update failed with Error: Invalid URI  *Steps to reproduce*  1. {{appc config set lastUpdateCheckTiDownloads null}}  2. {{appc new}} or {{appc run}}    *Expected result*   There should be no {{Error: Invalid URI}} error.    *Actual result*  The process terminates with {{Error: Invalid URI}} error.","",0,1,0,0,1,0,0,0,0,0,0,0,0,0
"CLI-1088","09/01/2016 13:57:22",3,"CLI should not re-prompt a user once their account has been locked out h5.Description    APPTS-8562 introduced the ability for accounts to be locked out after a certain amount of failed login attempts, the CLI does not handle this appropriately and outputs an access privileges error while also re-prompting the user.    The CLI should inform the user what has happened and provide any other details deemed necessary      h5.Steps to reproduce    # Run {{appc login}} and enter an incorrect password  # GOTO 1    h5.Actual result    After 6 attempts the error message changes to {{You do not have access privileges to view this content.}} the CLI will keep prompting the user to login    h5.Expected result    If a user is locked out of their  account, the CLI should not re-prompt and inform the user of the lockout, while displaying any information that is deemed helpful e.g Directing them to check their emails to disable the lockout","  ? Appcelerator ID: eharris@appcelerator.com  ? Password: ************  Invalid Appcelerator ID and password combination.    Appcelerator Login required to continue ...    ? Appcelerator ID: eharris@appcelerator.com  ? Password: ******************  You do not have access privileges to view this content.  ",1,0,0,0,1,0,0,0,0,0,0,0,0,0
"CLI-1089","09/01/2016 14:16:58",3,"Allow more than one attempt at entering an auth code h5.Description    Currently the CLI only allows a user 1 attempt at entering an auth code. This should be changed to allow the user unlimited attempts until the auth code expires, like the online login, or exit after a certain number of retries while outputting some information to the user.    h5.Steps to reproduce    # {{appc logout -D}}  # {{appc login}}  # Enter an incorrect auth code    h5.Actual result    The CLI will exit on one incorrect auth code    h5.Expected result    CLI should allow some retries on auth code","",1,0,0,0,1,0,0,0,0,0,0,0,0,0
"CLI-1090","09/01/2016 17:04:12",1,"update-notifier still getting installed h5.Description    API-1310 removed update-notifier, however when installing appcelerator npm package it still gets installed, this is because the npm shrinkwrap file still references the package [here|https://github.com/appcelerator/appc-install/blob/f5025900a1f056bc9c404f16d9d51a573dc447a1/npm-shrinkwrap.json#L579].     h5.Steps to reproduce    # Install appc npm using {{npm i -g appcelerator@4.2.8-6}}    h5.Actual results    update-notifier is installed    h5.Expected results    update-notifier should not be installed as it's not used","",0,1,0,0,1,0,0,0,0,0,0,0,0,0
"CLI-1094","09/06/2016 05:21:13",5,"Build got stuck at validating the session *Details:*    While I'm building a project with iOS simulator - build got stuck at {{check if session is invalidated}} state for more than {color:red}4mins{color}.    You can observe the time from the below trace log.          *Expected:*    It should timeout after 10sec or so.","  Appcelerator Command-Line Interface, version 5.4.0  Copyright (c) 2014-2016, Appcelerator, Inc.  All Rights Reserved.  2016-09-06T04:10:10.368Z | TRACE  | set environment to {""registry"":""https://software.appcelerator.com"",""security"":""https://security.appcelerator.com"",""baseurl"":""https://platform.appcelerator.com""}  2016-09-06T04:10:10.369Z | TRACE  | checking credentials for existing session  2016-09-06T04:10:10.498Z | TRACE  | Attempting to load session info from config file  2016-09-06T04:10:10.503Z | TRACE  | check if session is invalidated  2016-09-06T04:16:15.705Z | TRACE  | registry result undefined undefined true undefined false undefined  2016-09-06T04:16:15.705Z | TRACE  | registry returned undefined  2016-09-06T04:16:15.706Z | TRACE  | session expiry 1473739783566 false  2016-09-06T04:16:15.706Z | TRACE  | Arrow Cloud config file: /Users/kkolipaka/.acs  2016-09-06T04:16:15.717Z | TRACE  | found Arrow Cloud login { mid: '87d2b0b9eb3b3518fa6c2a16184cf800d60f6bb2',  ",0,1,0,0,1,0,0,0,0,0,0,0,0,0
"CLI-1097","09/08/2016 00:25:26",1,"Include Hyperloop ""version"" to plugin tag in the tiapp.xml At the moment, when enabling Hyperloop, no version property is assigned to the plugin tag. Under {{tiapp.xml}} you see:       Since we started versioning Hyperloop plugin, we should specify the plugin version in tiapp.xml.    ","    <plugins>      <plugin>hyperloop</plugin>    </plugins>  ",1,0,0,0,1,0,0,0,0,0,0,0,0,0
"CLI-1099","09/08/2016 19:24:51",1,"appc login error when specify arrowcloud url without protocol *Step to Reproduce*  Do {{appc login --cloud admin.cloudapp-enterprise.appcelerator.com}}    *Expected Result*  Login should succeed.    *Actual Result*  Login failed with error:  {{ERROR  | Invalid URI ""admin.cloudapp-enterprise.appcelerator.com/login""}}","",0,1,0,0,1,0,0,0,0,0,0,0,0,0
"CLI-1100","09/08/2016 21:45:52",5,"appc new to use SDK compatible version of soasta plugin At the moment, {{appc new}} and enable test service will always use the latest installed soasta plugin regardless of SDK version.    In APPTS-8874,  there'll be different versions of the plugin for ti sdk 6.0.0/newer, and ti sdk 5.5.X. {{appc new}} will need to be updated to use the compatible plugin version.","",1,0,0,0,1,0,0,0,0,0,0,0,0,0
"CLI-1107","09/15/2016 22:57:56",1,"deprecated minimatch. Please update to minimatch 3.0.2 or higher to avoid a RegExp DoS issue We should update all the places this appears    appcelerator@5.5.0 /Users/ingo/.appcelerator/install/5.5.0/package  ├─┬ acs@1.2.1  │ ├─┬ npm@2.14.22  │ │ ├─┬ node-gyp@3.3.0  │ │ │ ├─┬ glob@4.5.3  │ │ │ │ └─┬ minimatch@2.0.10  │ │ │ ├─┬ minimatch@1.0.0  ├─┬ arrow@1.8.6  │ ├─┬ babel@5.8.38  │ │ ├─┬ babel-core@5.8.38  │ │ │ ├─┬ minimatch@2.0.10  │ ├─┬ forever-monitor@1.7.0  │ │ ├─┬ minimatch@2.0.10  ├─┬ recursive-readdir@1.3.0  │ └─┬ minimatch@0.3.0  ├─┬ tar.gz@1.0.2  │ ├─┬ mocha@2.5.3  │ │ ├─┬ glob@3.2.11  │ │ │ └─┬ minimatch@0.3.0","",0,1,0,0,1,0,0,0,0,0,0,0,0,0
"CLI-1114","09/19/2016 20:16:59",1,"appc switch org: errors when I only have one org When I run {{appc switch org}} while I only have one org it errors:        Instead, it should simply say there are no other orgs to switch to.","  Fokkes-MacBook-Pro:ticons-server fokkezb$ appc switch org  Appcelerator Command-Line Interface, version 5.5.0  Copyright (c) 2014-2016, Appcelerator, Inc.  All Rights Reserved.    No orgs were found!  2016-09-19T19:16:35.169Z | ERROR  | true  ",0,1,0,0,0,0,0,0,0,1,0,0,0,0
"CLI-1115","09/21/2016 15:55:37",2,"Set Node 4.x as minimum supported version h5.Description    In 6.0.0/4.8.0 it's planned to move to 4.X as the minimum supported version. This is implemented in the [SDK/Titanium|TIMOB-23448] and in [TISTUD|TISTUD-8509] but there is no implementation for this in the CLI. It seems to me like we should want to restrict the version in the CLI also and maybe introduce something similar to Titanium i.e warnings for node versions higher than a certain version etc    h5.Steps to reproduce    # Set node 0.12.7 as your selected node version using your favourite node version manager or the official installer  # Download a 6.0.0 CLI, {{appc use 6.0.0-47}}  # Use the CLI for non titanium tasks (as Titanium has this already implemented)    h5.Actual result    The appc cli is perfectly happy with you using 0.12.7    h5.Expected result    As we are moving to a minimum of 4.X for every other product. So should the CLI","",1,0,0,0,1,0,0,0,0,0,0,0,0,0
