"issuekey","created","storypoint","context","codesnippet","t_Improvement","t_Bug","t_New.Feature","t_Story","c_Core","c_Titanium","c_Security","c_Verification","c_Registry","c_CLI","c_Installer","c_Node.Utilities","c_Documentation","c_Markdown"
"CLI-903","07/21/2014 20:09:25",13,"Investigate locking down NPM dependencies When deploying NPM modules, even if we specify exact versions in our package.json file, those dependencies could be less strict in what they choose to use. The end result is that every install of our NPM modules could be different, leading to difficult-to-reporduce bugs.    One solution is to use tools like shrink-wrap or lockdown:    https://www.npmjs.org/doc/cli/npm-shrinkwrap.html  https://www.npmjs.org/package/lockdown    Some goals:    * People can use NPM install from the NPMJS repo like before  * They only get the exact set of direct and indirect dependencies we've tested    There is a concern (as noted in APPTS-1879) that a dependency could be unpublished from NPM. It's unclear how prevalent that is, but it is a possibility.    If we instead decided to host a version of our nodules external to NPMJS, then we'd need to make sure we removed them from the main repo to avoid confusion.  ","",1,0,0,0,1,0,0,0,0,0,0,0,0,0
"CLI-649","03/21/2015 22:38:27",5,"Android build tool warning directs user to run ""ti config"" h5. Description:  I was warned in console of a potential compatibility issue with my build tools. This warned told me to set with ""ti config"". This should be updated to reflect new tools.        h5. Steps to reproduce:  1) Install Android build tools 22  2) Create an android project in studio or CLI and run on emulator or device    h5. Result:  The console warning appears with references to ""ti config""    h5. Expected Result:  The warning should say ""appc ti config""","[WARN] :     [WARN] :   Android Build Tools 22 are too new and may or may not work with Titanium.  [WARN] :   If you encounter problems, select a supported version with:  [WARN] :      ti config android.buildTools.selectedVersion ##.##.##  [WARN] :    where ##.##.## is a version in /Users/eric/Android_SDK/build-tools that is <=21.x",0,1,0,0,0,1,0,0,0,0,0,0,0,0
"CLI-517","04/03/2015 15:10:54",5,"Add ""appc test"" command I would like not to use any NPM commands when using Arrow as I feel it is confusing to jump between the two.    Add `appc test` which passes through to `npm test`","",1,0,0,0,1,0,0,0,0,0,0,0,0,0
"CLI-531","04/08/2015 00:28:39",5,"appc unpublish should support ""--project-dir"" h5. Description:  While closing a related ticket, I tried {{appc run}}, {{appc publish}}, and {{appc unpublish}} from outside the project directory. {{appc unpublish --project-dir}} does not work.    An error is shown like:      h5. Steps to reproduce:  1) Create or use an Arrow project, publish the app  2) From outside the directory, run {{appc unpublish --project-dir <your directory here>}}    h5. Result:  The app does not unpublish, {{appc unpublish}} help does not show support for {{--project-dir}}    h5. Expected Result:  Unpublish support for {{--project-dir}}","emerrimanMBP:~ eric$ appc unpublish --project-dir ~/arrowsCarbon/  Appcelerator Command-Line Interface, version 0.2.230  Copyright (c) 2014-2015, Appcelerator, Inc.  All Rights Reserved.    ERROR  | No component found or specified for unpublish  ",1,0,0,0,1,0,0,0,0,0,0,0,0,0
"CLI-615","04/14/2015 01:20:50",5,"Unable to run 'appc setup' on io.js appc won't setup on io.js    ","  appc setup                                                                                                                         [17:18:00]  Finding latest version ...0.2.242 ✓  Version 0.2.242 already installed.  ? Do you plan on developing Titanium apps? Yes    Checking your environment...    You have the latest Titanium SDK release 4.0.0.Beta2  ERROR  | titanium exited with 1 exit code  ",0,1,0,0,0,1,0,0,0,0,0,0,0,0
"CLI-561","04/17/2015 08:22:41",3,"Automatically prompt for new login when session is invalid Every now and then I get the error we see reported in the Q&A a lot as well:        Logging out (I using {{-D}} to be sure) and in again fixes it.    I think the UX would be better if don't spit out an error but inform the user the session as expired and he needs to login again. Then under the hood logout, clean up whatever we can and present the login again.    ","  ERROR | invalid session    ≫ appc new  Appcelerator Command-Line Interface, version 0.2.247  Copyright (c) 2014-2015, Appcelerator, Inc.  All Rights Reserved.    ? What type of project are you creating? Native App  ? Which SDK would you like to use? Titanium SDK (JavaScript)  ? What's the project name? bully  ? What's your application id (example: com.myapp)? nl.fokkezb  ERROR  | invalid session    (~/dev/tests)  ≫ appc logout -D  Appcelerator Command-Line Interface, version 0.2.247  Copyright (c) 2014-2015, Appcelerator, Inc.  All Rights Reserved.    logged out    (~/dev/tests)  ≫ appc login  Appcelerator Command-Line Interface, version 0.2.247  Copyright (c) 2014-2015, Appcelerator, Inc.  All Rights Reserved.    Appcelerator Login required to continue ...    ? Appcelerator ID: fzandbergen@appcelerator.com  ? Password: *********  ? Into which organization would you like to login? Appcelerator, Inc    This computer must be authorized before you can complete your login.    ? Confirm with authorization code to Email or Phone/SMS? SMS to +31624105142    An authorization code was sent to your phone at +31624105142    ? Please enter the code you received: 1086    This computer is now authorized: Mac OSX Serial Number: C02MP05QFH05  You can deauthorize this computer by logging out with appc logout    Generating Developer Certificate and Private/Public Keys...  fzandbergen@appcelerator.com logged into organization Appcelerator, Inc [14301]    (~/dev/tests)  ≫ appc new  Appcelerator Command-Line Interface, version 0.2.247  Copyright (c) 2014-2015, Appcelerator, Inc.  All Rights Reserved.    ? What type of project are you creating? Native App  ? Which SDK would you like to use? Titanium SDK (JavaScript)  ? What's the project name? bully  ? What's your application id (example: com.myapp)? nl.fokkezb  ? Please provide your password for enabling Test service: *********    *** new completed. ***  ",1,0,0,0,0,0,0,1,0,0,0,0,0,0
"CLI-563","04/17/2015 18:34:58",0,"Alert users when attempting to run an app that belongs to a different org than they are currently logged in as if the current user is logged in under Org A and tries to run an app created under Org B that fails. The error message is cryptic:    That's fine if the user has no rights to Org B, we shouldn't give any details about it. But if the user _is_ a member of the other org that the app belongs to, we should give more details about why we can't run this app. Specifically we should tell them they are logged in under Org A, the app is part of Org B and that they need to logout and back in under Org B to run it.","  [ERROR] :  Application not registered.  titanium exited with exit code 100  ",1,0,0,0,0,0,1,0,0,0,0,0,0,0
"CLI-570","04/21/2015 10:40:26",8,"Titanium always does full rebuild, forced by encryptJS When building a Titanium app for iOS Simulator, it always forces a rebuild because *JavaScript files need to be re-encrypted*. This even happens when you set deploy type to development. It does however *NOT* happen when you skip {{appc run}} and use {{ti build}} directly.    This issue makes rebuilds take a lot longer then needed.    h1. To reproduce    1. Create a project.  2. Run the project via AppC ({{appc run -p ios}}) once for an initial build.  3. Run the project via AppC again ({{appc run -p ios}}) and confirm it says: {{Forcing rebuild: JavaScript files need to be re-encrypted}} and later {{Forcing rebuild: ApplicationDefaults.m has changed since last build}}.  4. Run the project via AppC with development deployType ({{appc run -p ios -D development}}) once for a new build with changed deployType.  5. Run the project via AppC with development deployType ({{appc run -p ios -D development}}) again and confirm it says the same.  6. Run the project via Ti ({{ti build -p ios}}) once to generate a new build.  7. Run the project via Ti ({{ti build -p ios}}) again to confirm that this time it does not force a rebuild.    Found by this user:  https://community.appcelerator.com/topic/203/appcelerator-forcing-a-rebuild-for-javascript-re-encryption","",0,1,0,0,0,1,0,0,0,0,0,0,0,0
"CLI-571","04/21/2015 20:04:12",1,"Appc ti -v returns Appc CLI version When I run {{appc ti -v}} I get the output of {{appc -v}}.    *Steps to reproduce issue*:  1. Run {{appc ti -v}}    *Actual Results*:  Same output as {{appc -v}}    *Expected Results*:  Output should show the local Titanium CLI version.","",0,1,0,0,1,0,0,0,0,0,0,0,0,0
"CLI-573","04/22/2015 08:39:14",0,"Random ""Cannot find module"" errors when updating via ""appc use latest"" Every now and then people get {{Cannot find module}} errors during {{appc use latest}} and sometimes with {{appc run}}.    * https://community.appcelerator.com/topic/123/the-login-server-returned-an-error/19  * https://community.appcelerator.com/topic/150/can-not-login-to-appcelerator-studio/5  * https://community.appcelerator.com/topic/219/error-cannot-find-module-after-update-0-2-255  * https://community.appcelerator.com/topic/185/error-cannot-find-module-arrow/2 (slightly different, during appc run﻿)","",0,1,0,0,1,0,0,0,0,0,0,0,0,0
"CLI-574","04/22/2015 09:12:55",3,"Login validation error message not passed through prompt from CLI Please refer to Studio ticket.  https://jira.appcelerator.org/browse/TISTUD-7325    Studio is listening to CLI through socket communication through request and response protocol model.  In case of Sign-in, If user is not provided any credentials and entered Ok, will get the proper error message from CLI. The response looks like below.    {""type"":""error"",""message"":""validate error: you must enter a value for the Appcelerator ID"",""question"":[{""type"":""input"",""name"":""username"",""message"":""Appcelerator ID:""},{""type"":""password"",""name"":""password"",""message"":""Password:""}]}    If user provided wrong credentials, then CLI is not returning the error message from the server. Response looks like below.    {""type"":""question"",""question"":[{""type"":""input"",""name"":""username"",""message"":""Appcelerator ID:""},{""type"":""password"",""name"":""password"",""message"":""Password:""}]}    Expected: CLI should send error message, so that same will be passed back to the studio user, they can able to see what went wrong.","",1,0,0,0,1,0,0,0,0,0,0,0,0,0
"CLI-577","04/22/2015 17:53:45",5,"Need to add proxy logic to underlying appc process such as acs same as we're using here     https://github.com/appcelerator/appc-cli/blob/c0f602a2992ee27fbe8c7a1328eedec422f912a7/lib/constants.js#L200    this code above should reference APPC_CONFIG_PROXY env    and this code should be refactored    https://github.com/appcelerator/appc-cli/blob/7a134ba6a50624ea9046b1d7578547b8760b21ee/lib/commands/login.js#L511    we need the front-end and the appc cli to both respect the proxy.","",1,0,0,0,1,0,0,0,0,0,0,0,0,0
"CLI-579","04/22/2015 19:57:43",5,"Errors updating Core CLI when Studio is open When trying to update the Core CLI from terminal (via {{appc use latest}} or {{appc setup}}) I get errors when Studio is open.    *Steps to reproduce issue*  1. Open Studio  2. Run {{appc use latest}} (do not already have the latest version installed)  -----------------------  3. Delete the latest folder from {{~/.appcelerator/install}}  4. Close Studio  5. Run {{appc use latest}}    *Actual Results*  2. Install of latest version fails  5. Install succeeds    *Expected Results*  Installs of latest version succeed    *Notes*  This makes it very difficult to install CLI updates from inside Studio.  I tested this many times. 10/10 installs succeeded with Studio closed, 10/10 installs failed with Studio open.","",0,1,0,0,1,0,0,0,0,0,0,0,0,0
"CLI-585","04/22/2015 21:49:07",3,"Can not login in Appcelerator Studio Can not login to Appcelerator Studio, I'm receiving the error:  ERROR | Required body parameter: userAgent missing  ","",0,1,0,0,1,0,0,0,0,0,0,0,0,0
"CLI-582","04/23/2015 08:10:51",2,"CLI prompts for login twice when --env option is given in the command The cli prompts twice for login when --env option is given during appc new or appc run command. However, if username and password are provided as part of the command then it prompts twice for organization even if a valid --org-id is also passed in the command    Steps to Reproduce:  1. Run the command ""appc new --env preproduction""    Actual Result:  The user is forced to enter username, password and organization selection two times.    ","  ssekhri-MBP:testing ssekhri$ appc whoami  Appcelerator Command-Line Interface, version 0.2.261  Copyright (c) 2014-2015, Appcelerator, Inc.  All Rights Reserved.    ssekhri@appcelerator.com in organization qe_test_org_preprod_team (100001710)  ssekhri-MBP:testing ssekhri$ appc new --env preproduction  Appcelerator Command-Line Interface, version 0.2.261  Copyright (c) 2014-2015, Appcelerator, Inc.  All Rights Reserved.    Appcelerator Login required to continue ...    ? Appcelerator ID: ssekhri@appcelerator.com  ? Password: ******  ? Into which organization would you like to login? qe_test_org_preprod_team  Appcelerator Login required to continue ...    ? Appcelerator ID: ssekhri@appcelerator.com  ? Password: ******  ? Into which organization would you like to login? qe_test_org_preprod_team  ? What type of project are you creating? (Use arrow keys)  ❯ Native App     Arrow App     Titanium Module   ",0,1,0,0,1,0,0,0,0,0,0,0,0,0
"CLI-586","04/23/2015 19:08:04",3,"Clean up appc new arguments Clean up the undefined arguments passed to titanium during app creation. This could cause problems.    ","  args [ 'create',    '-t',    'app',    '--platforms',    'all',    '--no-banner',    '--no-prompt',    '--workspace-dir',    '/Users/gmathews/github/appc',    undefined,    true,    '--log-level',    'info',    undefined,    true,    undefined,    'app',    undefined,    'titanium',    undefined,    'titanium',    '--name',    'testApp',    '--id',    'com.test',    '--project-dir',    '/Users/gmathews/github/appc/testApp',    '--url',    'unspecified' ]  ",1,0,0,0,1,0,0,0,0,0,0,0,0,0
"CLI-588","04/24/2015 01:48:27",3,"Rebuilding an application for Android emulator fails h5.Description    When rebuilding an application for Android emulator using 0.2.269 the build exits with the following         Full logs are attached as fullOutput.txt     *If I set encryptJS to true [here|https://github.com/appcelerator/appc-cli-titanium/blob/master/hook/titanium.js#L147] then the build has no problems.*    h5.Steps To Reproduce    1. Create a new application using {{appc new}}  2. Build the application for Android using {{appc run -p android -T emulator}}  3. Rebuild the application for Android using {{appc run -p android -T emulator}}    h5.Actual Result    The build will fail with the output above     h5.Expected Result    The build should pass","  [INFO]  Generating i18n files  [INFO]  Generating /Users/eharris/Documents/sambotWorkspace/android/build/android/res/values/theme.xml  TRACE  | titanium exited with exit code 0  ",0,1,0,0,0,1,0,0,0,0,0,0,0,0
"CLI-591","04/24/2015 22:20:00",2,"Build to an iOS device and then an iOS simulator fails h5.Description    When building an iOS app, if you build the app for device and then build the device for simulator the build for simulator will fail with the following error    {code: title=error 1}  [DEBUG] [ioslib] [ios-sim] [DEBUG] Session could not be started: Error Domain=NSPOSIXErrorDomain Code=22 ""Installation Failed"" UserInfo=0x7f916347ea40 {NSLocalizedDescription=Installation Failed, NSLocalizedRecoverySuggestion=An error occurred while preparing the app for installation (no bundle identifier was found at the expected path)}  [DEBUG] [ioslib] [ios-sim] Exited with code: 1  [ERROR] Project failed to build after 7s 726ms  [ERROR] An error occurred running the iOS Simulator (ios-sim exit code 1)      From what I see, if I wait the full time required for the rebuild (1 hour) then it seems to work fine.    Setting [this line|https://github.com/appcelerator/appc-cli-titanium/blob/master/hook/titanium.js#L146] to be true makes the build work everytime!    The fix for CLI-588 *does not fix this issue*    h5.Steps To Reproduce    1. Create a new application using {{appc new}}  2. Run the app on simulator using {{appc run -p ios -T simulator}}  3. Run the app on device using {{appc run -p ios -T device}}  4. Run the app on simulator using {{appc run -p ios -T simulator}}  5. Clean the app {{appc ti clean}}  6. Run the app on simulator using {{appc run -p ios -T simulator}}    h5.Actual Result    2. App will be built successfully  3. App will be built successfully  4. App will not be built successfully (see error 1)  6. App will not be built successfully (see error 2)      h5.Expected Result    App should be successfully every time","  [DEBUG] [ioslib] [ios-sim] [DEBUG] Session could not be started: Error Domain=NSPOSIXErrorDomain Code=22 ""Installation Failed"" UserInfo=0x7f916347ea40 {NSLocalizedDescription=Installation Failed, NSLocalizedRecoverySuggestion=An error occurred while preparing the app for installation (no bundle identifier was found at the expected path)}  [DEBUG] [ioslib] [ios-sim] Exited with code: 1  [ERROR] Project failed to build after 7s 726ms  [ERROR] An error occurred running the iOS Simulator (ios-sim exit code 1)    [DEBUG] Setting Info.plist CFBundleVersion to 1.0  [DEBUG] Setting Info.plist CFBundleShortVersionString to 1.0  TRACE  | titanium exited with exit code 0  ",0,1,0,0,0,1,0,0,0,0,0,0,0,0
"CLI-604","04/29/2015 13:01:20",3,"ENOTEMPTY error when creating titanium project  Run the following command the first time, the project files are created in */Users/feonsua/work/sandbox1/sandbox2/sandbox3*  Run the command again, a classic project is created under */Users/feonsua/work/sandbox1/sandbox2/app1*, which is one directory up than what was being specified. Then the process is terminated with an error message.        This happens when the --project-dir specified is different from the project name.","  Feons-MacBook-Pro:~ feonsua$ appc new --type titanium --name app1 --id com.test --project-dir /Users/feonsua/work/sandbox1/sandbox2/sandbox3 --force  Appcelerator Command-Line Interface, version 0.2.273  Copyright (c) 2014-2015, Appcelerator, Inc.  All Rights Reserved.    ERROR  | ENOTEMPTY, directory not empty '/Users/feonsua/work/sandbox1/sandbox2/app1'  ",0,1,0,0,0,1,0,0,0,0,0,0,0,0
"CLI-605","04/30/2015 05:35:05",5,"Attempt to retry when registry is not available For the appcelerator front-end (apps-install) need to retry when registry is unavailable.    Will try up to 10 times with each iteration waiting 500 x N (where N= is retry count)","",1,0,0,0,1,0,0,0,0,0,0,0,0,0
"CLI-606","04/30/2015 07:26:39",5,"""appc -v"" should show both the NPM and active version When we're debugging user problems we ask them to make sure they're on the latest version of the appcelerator NPM package. But the only way to check is:        We should include both the NPM and active version with {{appc -v}}.        Q&A: https://community.appcelerator.com/topic/285/appc-setup-causing-error-with-exit-code-1/2","  $ npm list -g --depth 0 appcelerator    $ appc -v  npm: 0.3.51  cli: 0.2.273  ",1,0,0,0,1,0,0,0,0,0,0,0,0,0
"CLI-607","04/30/2015 20:16:05",1,"Creating a project with an invalid session errors out after logging in h5.Description    After a session has been invalidated due to logging in on a different machine when creating a new project the CLI will prompt you to login again and authorize your hardware. After logging in the project creation fails with the below.        Just before this error when running with -l trace the following is output, it appears that the session that the CLI is using in not a valid session.         Full output is attached as fullOuput.txt    *When running {{appc new}} after this failure it does not fail*    h5.Steps To Reproduce    1. Login on machine Y {{appc login}}  2. Login on machine X {{appc login}}  3. Create an app on machine X {{appc new}}  4. Create an app on machine Y {{appc new}}  5. Login when prompted    h5.Actual Result    The project creation will error out with the above    h5.Expected Result    The project creation should be successful ","  ERROR  | Error      at Request._callback (/Users/eharris/.appcelerator/install/0.2.274/package/node_modules/appc-cli-titanium/plugins/new.js:305:23)      at Request.self.callback (/Users/eharris/.appcelerator/install/0.2.274/package/node_modules/request/request.js:368:22)      at Request.emit (events.js:98:17)      at Request.<anonymous> (/Users/eharris/.appcelerator/install/0.2.274/package/node_modules/request/request.js:1219:14)      at Request.emit (events.js:117:20)      at IncomingMessage.<anonymous> (/Users/eharris/.appcelerator/install/0.2.274/package/node_modules/request/request.js:1167:12)      at IncomingMessage.emit (events.js:117:20)      at _stream_readable.js:944:16      at process._tickCallback (node.js:448:13)    sending app post { method: 'post',    json:      { session: 'a9adbc3a5dea29d6a17823ad6a6ceb215ca50cae sa1eZdG82mfMMvDxYxpD4WPbTNpTT6X+p+J4YqfKjNyPXmd1KgNgAmXZvO/SmyFxarxxKT359VcElJm4YR1RhTAQTQrHEehfRFbtWCqyiU0QnGRyK7LnB/+eC0vAD+EpnnCaQ8WWOdLXisvrh77+jqwr+mEuwL2NIQMRoiGxR3E0eeiBpawTFHmI5Xl8Rebn5PRovXCqThbKmoMeg7wTO0rHIdzNY9M9+ju5HXLUID2v+kCUWHVB3aF9hsJeP/Ph/1eV4jLSte5jsJmrRUsXBhMcXBe9YVjQ3Il+9WHYN7DxQ/1tTAT5a1Ym18DO1hc0SCjiH3Fwoc5GrAiAo1RlWvepNpM5dU1w5HapoT0o1N9m9P/tRdi7s4LQJvS1x2lA1t2birl2lM1KrGkFiuDd8N17eLsSRaV2fC3pC1+0oo4+9QpNrY+XzsMYhhhll2LGN8sbLY1T2zCtqMrzgabE0O2Q8/8aR/v8Ct9gBnVr/PpkgwX/SW27rfHaHEsRdhA7IFlf63vPsD2zkuRLsuOY4xPIG0mhrZoPxUIqfukqzP9R3DoR/TebediC+FdAu2I0rAzorPn89WsaxujxRM5JMec1x3aqw/EJX7v3jZn86W4dtDxsqkqdRu0qziK5hCRZ+1DnjUTh1Uq9SPwjZTH+BkWH2Gc6KDLHvQHka3QNprvq5eYS2GXUSu8sYzl5xaOmXOO820ksTPFBqWclTbg0uwLj5HgCn3Ck01u/XFKyNkThBXTv//InHE6wJR+ypjMrxG0zyqwRW/DlvBHztmzlABpwXGaP0BYVRide0hnoZ2o=',       tiapp: '<?xml version=""1.0"" encoding=""UTF-8""?><ti:app xmlns:ti=""http://ti.appcelerator.org"">\r\n\t<id>com.appc.testApp123</id>\r\n\t<name>testApp123</name>\r\n\t<version>1.0</version>\r\n\t<publisher>not specified</publisher>\r\n\t<url>unspecified</url>\r\n\t<description/>\r\n\t<copyright>not specified</copyright>\r\n\t<icon>appicon.png</icon>\r\n\t<fullscreen>false</fullscreen>\r\n\t<navbar-hidden>false</navbar-hidden>\r\n\t<analytics>true</analytics>\r\n\t<guid>2760f5af-3b92-451b-94e6-4c21d1088da6</guid>\r\n\t<property name=""ti.ui.defaultunit"" type=""string"">dp</property>\r\n\t<ios>\r\n\t\t<plist>\r\n\t\t\t<dict>\r\n\t\t\t\t<key>UISupportedInterfaceOrientations~iphone</key>\r\n\t\t\t\t<array>\r\n\t\t\t\t\t<string>UIInterfaceOrientationPortrait</string>\r\n\t\t\t\t</array>\r\n\t\t\t\t<key>UISupportedInterfaceOrientations~ipad</key>\r\n\t\t\t\t<array>\r\n\t\t\t\t\t<string>UIInterfaceOrientationPortrait</string>\r\n\t\t\t\t\t<string>UIInterfaceOrientationPortraitUpsideDown</string>\r\n\t\t\t\t\t<string>UIInterfaceOrientationLandscapeLeft</string>\r\n\t\t\t\t\t<string>UIInterfaceOrientationLandscapeRight</string>\r\n\t\t\t\t</array>\r\n\t\t\t\t<key>UIRequiresPersistentWiFi</key>\r\n\t\t\t\t<false/>\r\n\t\t\t\t<key>UIPrerenderedIcon</key>\r\n\t\t\t\t<false/>\r\n\t\t\t\t<key>UIStatusBarHidden</key>\r\n\t\t\t\t<false/>\r\n\t\t\t\t<key>UIStatusBarStyle</key>\r\n\t\t\t\t<string>UIStatusBarStyleDefault</string>\r\n\t\t\t</dict>\r\n\t\t</plist>\r\n\t</ios>\r\n\t<android xmlns:android=""http://schemas.android.com/apk/res/android"">\r\n\t</android>\r\n\t<mobileweb>\r\n\t\t<precache>\r\n\t\t</precache>\r\n\t\t<splash>\r\n\t\t\t<enabled>true</enabled>\r\n\t\t\t<inline-css-images>true</inline-css-images>\r\n\t\t</splash>\r\n\t\t<theme>default</theme>\r\n\t</mobileweb>\r\n\t<modules>\r\n\t</modules>\r\n\t<deployment-targets>\r\n\t\t<target device=""android"">true</target>\r\n\t\t<target device=""ipad"">true</target>\r\n\t\t<target device=""iphone"">true</target>\r\n\t\t<target device=""mobileweb"">true</target>\r\n\t</deployment-targets>\r\n\t<sdk-version>4.0.0.v20150430090209</sdk-version>\r\n<plugins><plugin version=""1.0"">ti.alloy</plugin>\n</plugins>\n</ti:app>' },    gzip: true,    url: 'https://de7a3ab4b12bf1d3d4b7fde7f306c11bc2b98f67.cloudapp-enterprise-preprod.appctest.com/app' }  app post response { success: false,    error: 'invalid session',    code: 'com.appcelerator.security.invalid.session' }  done with plugin [Error]  ",0,1,0,0,0,1,0,0,0,0,0,0,0,0
"CLI-609","05/02/2015 00:48:12",1,"Improve password masking for appc-logger see https://github.com/appcelerator/appc-cli/pull/145","",1,0,0,0,1,0,0,0,0,0,0,0,0,0
