"issuekey","created","storypoint","context","codesnippet","t_Improvement","t_Bug","t_New.Feature","t_Story","c_Core","c_Titanium","c_Security","c_Verification","c_Registry","c_CLI","c_Installer","c_Node.Utilities","c_Documentation","c_Markdown"
"CLI-737","07/18/2015 00:26:26",5,"Files are encrypted on first build when building with development deploy type h5.Description    When building with a deploy type of development(simulator/emulator build) on the first build the files are being encrypted. On iOS and Android this appears to be handled fine, however on Windows there appears to be issues as the build will not get further than the encryption stage. See the below logging for a comparison between 4.1.0 and 4.1.1-7 CLI.     I am *unsure if this is a regression* as it may be expected with the changes to build verification but it is a *change in behavior*.     Due to this on the first build to a Windows Phone emulator the build will stop at {{Processing JavaScript files}} and not continue, killing the build and rebuilding will fix this.    {code: title=4.1.0}  [INFO]  Building for Windows Phone emulator: 8-1-1  [INFO]  Deploy type: development  [INFO]  Debugging disabled  [INFO]  Profiler disabled  [INFO]  Forcing rebuild: C:\Users\WINDO_~1\AppData\Local\Temp\hmm10\build-manifest.json does not exist  [INFO]  Launching emulator: 8-1-1  [INFO]  Processing JavaScript files  [INFO]  Generating i18n files  [INFO]  Generating Native Type Wrappers  [INFO]  Generating stubs for: Platform.Object  [INFO]  Setting up native modules for CMakeLists.txt...      h5.Steps to reproduce    1. Create a project using {{appc new --type titanium --classic --name appName --id com.appc --force}}  2. Build using appc CLI 4.1.0 using {{appc run -p ios -T simulator}}  3. Create a project using {{appc new --type titanium --classic --name appName --id com.appc --force}}  2. Build using appc CLI 4.1.1 using {{appc run -p ios -T simulator}}    h5.Actual result    When building to simulator/emulator for the first time on 4.1.1-7 the files will be encrypted    h5.Expected result    Based on historical behavior when building to simulator/emulator the files should not be encrypted at all","  [INFO]  Building for Windows Phone emulator: 8-1-1  [INFO]  Deploy type: development  [INFO]  Debugging disabled  [INFO]  Profiler disabled  [INFO]  Forcing rebuild: C:\Users\WINDO_~1\AppData\Local\Temp\hmm10\build-manifest.json does not exist  [INFO]  Launching emulator: 8-1-1  [INFO]  Processing JavaScript files  [INFO]  Generating i18n files  [INFO]  Generating Native Type Wrappers  [INFO]  Generating stubs for: Platform.Object  [INFO]  Setting up native modules for CMakeLists.txt...    [INFO]  Building for Windows Phone emulator: 8-1-1  [INFO]  Deploy type: development  [INFO]  Debugging disabled  [INFO]  Profiler disabled  [INFO]  Forcing rebuild: C:\Users\WINDO_~1\AppData\Local\Temp\hmm10\build-manifest.json does not exist  [INFO]  Launching emulator: 8-1-1  [INFO]  Windows Phone emulator is ready  [INFO]  JavaScript files need to be encrypted  [INFO]  Processing JavaScript files    ",0,1,0,0,0,1,0,0,0,0,0,0,0,0
"CLI-740","07/22/2015 18:50:29",5,"Remove unnecessary secondary call to retrieve user information h6.Accounts Details  {quote}  Account:   fism_dl_tidistribution@fisglobal.com     Joined:   Jul 20, 2015 10:19 PM   Last Updated:   ---   Organization:   FIS Mobile Sandbox   (100000356)         Account:   fism_dl_tidevelopment@fisglobal.com     Joined:   Jul 20, 2015 10:20 PM   Last Updated:   ---   Organization:   FIS Mobile Sandbox   (100000356)  {quote}    h6.Still asking for the auth code. Here is the terminal output:   ","  05:57:50 [~/App_Studio_Workspace/TitaniumPaydiantSDKiOS_ARC] óÔÔò ʕ·͡ᴥ·ʔ óÔÔò appc logout 18 ↵   Appcelerator Command-Line Interface, version 4.1.2   Copyright (c) 2014-2015, Appcelerator, Inc. All Rights Reserved.     logged out   05:57:53 [~/App_Studio_Workspace/TitaniumPaydiantSDKiOS_ARC] óÔÔò ʕ·͡ᴥ·ʔ óÔÔò appc login   Appcelerator Command-Line Interface, version 4.1.2   Copyright (c) 2014-2015, Appcelerator, Inc. All Rights Reserved.     Appcelerator Login required to continue ...     ? Appcelerator ID: fism_dl_tidevelopment@fisglobal.com   ? Password: **********     This computer must be authorized before you can complete your login.     An authorization code was sent to your email at fism_dl_tidevelopment@fisglobal.com     ? Please enter the authorization code you received via your email at fism_dl_tidevelopment@fisglobal.com:   ",0,1,0,0,0,0,0,1,0,0,0,0,0,0
"CLI-741","07/28/2015 15:54:42",8,"Allow for refreshing of session without logging in again explicitly Although we have lengthened the session duration to three days, the better approach is to allow silent refresh of the session behind the scenes. Both Google and Salesforce have such a mechanism:    https://developer.salesforce.com/docs/atlas.en-us.api_rest.meta/api_rest/intro_understanding_refresh_token_oauth.htm    https://developers.google.com/identity/protocols/OAuth2WebServer?hl=en","",1,0,0,0,1,0,0,0,0,0,0,0,0,0
"CLI-746","07/29/2015 00:18:54",5,"Add SPDX-compliant license string We should use the SPDX ""LicenseRef-LICENSE"" instead of ""Appcelerator Commercial"" in our package.json files to avoid the warning ""license should be a valid SPDX license expression""    This would also include the addition of a LICENSE.md file at the root","",1,0,0,0,1,0,0,0,0,0,0,0,0,0
"CLI-747","07/29/2015 05:37:30",1,"Node processes are getting orphaned in certain cases If you kill a top level process like appc run (the first process), the sub processes that are spawned are not killed and become orphaned.    I am easily able to reproduce this with a test case.  Sometimes you can reproduce it with killing the process with CTRL+C before fully started running.    You can probably also easily reproduce this by starting an arrow server successfully then just sending a kill SIGINT to the main appc process from ps.  ","",0,1,0,0,1,0,0,0,0,0,0,0,0,0
"CLI-754","08/06/2015 03:28:07",1,"CLI: Add support for --no-progress flag to hide progress bars The ""appc"" command uses a progress bar to show how much of an SDK has been downloaded or published. The problem is the progress bar keeps writing to stdout and if you subprocess the ""appc sdk"" command or pipe the output to a file, the output is all messed up. It would better to just have a flag that disables the progress bar.","",0,0,1,0,1,0,0,0,0,0,0,0,0,0
"CLI-755","08/06/2015 18:16:14",5,"Cannot run appc commands with CLI 4.2.0-5+ When using CLI core 4.2.0-5+ I am unable to build, clean, or run {{appc info}}. I get the below error:      *Steps to reproduce issue*  1. Install and use CLI core 4.2.0-5+  2. Build a project from the CLI    *Actual Results*  Commands fail with above error    *Expected Results*  Commands run without error    *Notes*  Workaround is to go to your appc-cli-titanium folder and run {{npm install}}    ","  Failed to load appc-cli-titanium plugin from /Users/ewieber/.appcelerator/install/4.2.0-5/package/node_modules/appc-cli-titanium: Cannot find module 'tmp'  Preproduction Environment Active    Error: Cannot find module 'tmp'      at Function.Module._resolveFilename (module.js:338:15)      at Function.Module._load (module.js:280:25)      at Module.require (module.js:364:17)      at require (module.js:380:17)      at Object.<anonymous> (/Users/ewieber/.appcelerator/install/4.2.0-5/package/node_modules/appc-cli-titanium/plugins/util.js:25:8)      at Module._compile (module.js:456:26)      at Object.Module._extensions..js (module.js:474:10)      at Module.load (module.js:356:32)      at Function.Module._load (module.js:312:12)      at Module.require (module.js:364:17)  EWieberMBA:CardEngine ewieber$ appc run -p ios --force  Appcelerator Command-Line Interface, version 4.2.0-5  Copyright (c) 2014-2015, Appcelerator, Inc.  All Rights Reserved.    WARN   | Failed to load appc-cli-titanium plugin from /Users/ewieber/.appcelerator/install/4.2.0-5/package/node_modules/appc-cli-titanium: Cannot find module 'tmp'  Preproduction Environment Active    Failed to load appc-cli-titanium plugin from /Users/ewieber/.appcelerator/install/4.2.0-5/package/node_modules/appc-cli-titanium: Cannot find module 'tmp'  ERROR  | No valid targets for run. Are you in a project folder?    DEBUG  | [PLUGIN-LOAD] 0ms /Users/ewieber/.appcelerator/install/4.2.0-5/package/appc.js    appc:sdk set production to https://platform.appcelerator.com +0ms  WARN   | Failed to load appc-cli-titanium plugin from /Users/ewieber/.appcelerator/install/4.2.0-5/package/node_modules/appc-cli-titanium    Error: Cannot find module 'tmp'      at Function.Module._resolveFilename (module.js:338:15)      at Function.Module._load (module.js:280:25)      at Module.require (module.js:364:17)      at require (module.js:380:17)      at Object.<anonymous> (/Users/ewieber/.appcelerator/install/4.2.0-5/package/node_modules/appc-cli-titanium/plugins/util.js:25:8)      at Module._compile (module.js:456:26)      at Object.Module._extensions..js (module.js:474:10)      at Module.load (module.js:356:32)      at Function.Module._load (module.js:312:12)      at Module.require (module.js:364:17)  DEBUG  | [PLUGIN-LOAD] 0ms /Users/ewieber/.appcelerator/install/4.2.0-5/package/node_modules/arrow/appc.js    appc:sdk set production to https://platform.appcelerator.com +0ms  log level set to ""trace""  executing command ""run""    appc:sdk set preproduction to https://360-preprod.cloud.appctest.com +412ms  Preproduction Environment Active    set environment to {""registry"":""https://software-preprod.cloud.appctest.com"",""security"":""https://security-preprod.cloud.appctest.com"",""baseurl"":""https://360-preprod.cloud.appctest.com""}  checking credentials for existing session  Attempting to load session info from config file  check if session is invalidated    appc:sdk api response, err=null, body='{""success"":true,""result"":{""_id"":""52a6686f6f55f4c71f00000e"",""user_id"":1502094,""guid"":""140c7c37-542c-46f4-9fd2-9e3775972432"",""openid"":""18a8f7e1-fb81-4163-b9cb-3941a69d78a8"",""firstname"":""Eric"",""lastname"":""Wieber"",""username"":""ewieber@appcelerator.com"",""email"":""ewieber@appcelerator.com"",""is_staff"":true,""org_id"":100001711}}' +317ms  session expiry 1438899154275 false  Arrow Cloud config file: /Users/ewieber/.acs  found Arrow Cloud login { mid: '662eaf87211bfeea94c2d90fde5a774fe958c6e8',    publishPort: 443,    publishHost: 'https://admin.cloudapp-enterprise-preprod.appctest.com',    username: 'ewieber@appcelerator.com',    cookie: [ 'connect.sid=s%3ACEx4KSsQPqo7BytNjQ2C1egN.DXl385vkJcEKhpGc2KKVNEA0D4ymLyAxeUB9qh4S2Uc; Path=/; Expires=Thu, 06 Aug 2015 22:13:18 GMT; HttpOnly' ],    defaultEP:      { publishHost: 'https://admin.cloudapp-enterprise-preprod.appctest.com',       publishPort: 443 } } , checking nodeACSEndpoint= https://admin.cloudapp-enterprise-preprod.appctest.com  Arrow Cloud cookie expiry [ 1438899198000 ]  session already loaded in opts.session  getCredentials() session:  {    ""ipaddress"": ""172.16.0.28"",    ""username"": ""ewieber@appcelerator.com"",    ""password"": ""<OMITTED>"",    ""session"": ""<OMITTED>"",    ""nonce"": ""<OMITTED>"",    ""environment"": {      ""name"": ""production"",      ""isProduction"": true,      ""acsBaseUrl"": ""https://preprod-api.cloud.appctest.com"",      ""acsAuthBaseUrl"": ""https://dolphin-secure-identity.cloud.appcelerator.com"",      ""nodeACSEndpoint"": ""https://admin.cloudapp-enterprise-preprod.appctest.com""    },    ""token"": ""<OMITTED>"",    ""fingerprint"": ""662eaf87211bfeea94c2d90fde5a774fe958c6e8"",    ""fingerprint_description"": ""Mac OSX Serial Number: C02H6083DRQ4"",    ""org_id"": 100001711,    ""expiry"": 1438899154275  }  loading plugins for command ""run""  run search paths:  [    ""/Users/ewieber/.appcelerator/install/4.2.0-5/package"",    ""/Users/ewieber/.appcelerator/install/4.2.0-5/package/node_modules"",    ""/Users/ewieber/Documents/Appcelerator_Studio_Workspace_save/CardEngine/plugins"",    ""/Users/ewieber/Documents/Appcelerator_Studio_Workspace_save/CardEngine/node_modules"",    ""/Users/ewieber/Documents/Appcelerator_Studio_Workspace_save/node_modules"",    ""/Users/ewieber/Documents/node_modules"",    ""/Users/ewieber/node_modules"",    ""/Users/node_modules"",    ""/node_modules"",    ""/Users/ewieber/.appcelerator/.npm/lib/node_modules""  ]  [PLUGIN-LOAD] 0ms /Users/ewieber/.appcelerator/install/4.2.0-5/package/appc.js    appc:sdk set preproduction to https://360-preprod.cloud.appctest.com +0ms  Failed to load appc-cli-titanium plugin from /Users/ewieber/.appcelerator/install/4.2.0-5/package/node_modules/appc-cli-titanium    Error: Cannot find module 'tmp'      at Function.Module._resolveFilename (module.js:338:15)      at Function.Module._load (module.js:280:25)      at Module.require (module.js:364:17)      at require (module.js:380:17)      at Object.<anonymous> (/Users/ewieber/.appcelerator/install/4.2.0-5/package/node_modules/appc-cli-titanium/plugins/util.js:25:8)      at Module._compile (module.js:456:26)      at Object.Module._extensions..js (module.js:474:10)      at Module.load (module.js:356:32)      at Function.Module._load (module.js:312:12)      at Module.require (module.js:364:17)  [PLUGIN-LOAD] 1ms /Users/ewieber/.appcelerator/install/4.2.0-5/package/node_modules/arrow/appc.js  run plugin: /Users/ewieber/.appcelerator/install/4.2.0-5/package/node_modules/arrow  plugin ""arrow"" failed its ""when"" function check, skipping...  Duplicate option ""colors"" for command ""run"", removing...  executing command ""run"" with the following plugins:  []  ERROR  | Error: No valid targets for run. Are you in a project folder?      at async.series.async.each.executeArgs (/Users/ewieber/.appcelerator/install/4.2.0-5/package/lib/commands/run.js:26:15)      at /Users/ewieber/.appcelerator/install/4.2.0-5/package/node_modules/async/lib/async.js:607:21      at /Users/ewieber/.appcelerator/install/4.2.0-5/package/node_modules/async/lib/async.js:246:17      at iterate (/Users/ewieber/.appcelerator/install/4.2.0-5/package/node_modules/async/lib/async.js:146:13)      at async.eachSeries (/Users/ewieber/.appcelerator/install/4.2.0-5/package/node_modules/async/lib/async.js:162:9)      at _asyncMap (/Users/ewieber/.appcelerator/install/4.2.0-5/package/node_modules/async/lib/async.js:245:13)      at Object.mapSeries (/Users/ewieber/.appcelerator/install/4.2.0-5/package/node_modules/async/lib/async.js:228:23)      at Object.async.series (/Users/ewieber/.appcelerator/install/4.2.0-5/package/node_modules/async/lib/async.js:605:19)      at run (/Users/ewieber/.appcelerator/install/4.2.0-5/package/lib/commands/run.js:21:8)      at /Users/ewieber/.appcelerator/install/4.2.0-5/package/lib/core.js:498:12    appc:run signal received +2s exit sending to { domain: null,    _events: { close: [Function] },    _maxListeners: 10,    _closesNeeded: 1,    _closesGot: 1,    connected: false,    signalCode: null,    exitCode: 1,    killed: false,    _handle: null,    pid: 6576,    stdin: null,    stdout: null,    stderr: null,    stdio: [ null, null, null ] }  ",0,1,0,0,1,0,0,0,0,0,0,0,0,0
"CLI-758","08/10/2015 17:13:13",1,"Cannot install 4.2.0-12+; memwatch-next install errors When trying to install any CLI Core version 4.2.0-12 or higher, I get the below error:      *Steps to reproduce issue*  1. Do not have CLI 4.2.0-12 or higher installed  2. Run {{appc use 4.2.0-12}} or any 4.2.0-X where X > 12    *Actual Results*  I get the above error and cannot install    *Expected results*  I do not get an error and can install the CLI    *Notes*  Tested 4.2.0-12 through 4.2.0-24","  EWieberMBA:Appcelerator_Studio_Workspace ewieber$ appc use 4.2.0-12  Before you can continue, the latest Appcelerator software update needs to be downloaded.    Finding version 4.2.0-12 ... ✓  Validating security checksum ✓  Installing ... ✓  Compiling platform native modules ...  └ extract-opts/typechecker ... ✓  └ bunyan/dtrace-provider ...  ✓  └ extract-opts/typechecker ...  ✓  └ socket.io-client/ws ...  ✓  └ ws/bufferutil ...  ✓  └ ws/utf-8-validate ...  ✓  └ ldapjs/dtrace-provider ...  ✓  └ arrow/memwatch-next ... npm WARN package.json uuid-v4@0.1.0 No repository field.  ld: library not found for -lgcc_s.10.5  clang: error: linker command failed with exit code 1 (use -v to see invocation)  make: *** [Release/memwatch.node] Error 1  gyp ERR! build error   gyp ERR! stack Error: `make` failed with exit code: 2  gyp ERR! stack     at ChildProcess.onExit (/usr/local/lib/node_modules/npm/node_modules/node-gyp/lib/build.js:267:23)  gyp ERR! stack     at ChildProcess.emit (events.js:98:17)  gyp ERR! stack     at Process.ChildProcess._handle.onexit (child_process.js:820:12)  gyp ERR! System Darwin 15.0.0  gyp ERR! command ""node"" ""/usr/local/lib/node_modules/npm/node_modules/node-gyp/bin/node-gyp.js"" ""rebuild""  gyp ERR! cwd /Users/ewieber/.appcelerator/install/4.2.0-12/package/node_modules/arrow/node_modules/memwatch-next  gyp ERR! node -v v0.10.37  gyp ERR! node-gyp -v v1.0.1  gyp ERR! not ok     npm ERR! memwatch-next@0.2.7 install: `node-gyp rebuild`  npm ERR! Exit status 1  npm ERR!   npm ERR! Failed at the memwatch-next@0.2.7 install script.  npm ERR! This is most likely a problem with the memwatch-next package,  npm ERR! not with npm itself.  npm ERR! Tell the author that this fails on your system:  npm ERR!     node-gyp rebuild  npm ERR! You can get their info via:  npm ERR!     npm owner ls memwatch-next  npm ERR! There is likely additional logging output above.  npm ERR! System Darwin 15.0.0  npm ERR! command ""node"" ""/usr/local/bin/npm"" ""install"" ""memwatch-next@0.2.7"" ""--production""  npm ERR! cwd /Users/ewieber/.appcelerator/install/4.2.0-12/package/node_modules/arrow  npm ERR! node -v v0.10.37  npm ERR! npm -v 1.4.28  npm ERR! code ELIFECYCLE  npm ERR! not ok code 0  ",0,1,0,0,1,0,0,0,0,0,0,0,0,0
"CLI-761","08/10/2015 19:52:20",8,"Publish titanium module into Marketplace The appc-cli currently supports publishing only Arrow services to registry. It has to add support for publishing titanium modules into registry.    While appc-cli creates a module, it should create a appc.json file in the root of the project directory and should contain information about the author/owner, type (timodule), module description, version, license, support details, access level, license etc.    If the appc.json file is not available during publish, then it has to prompt for basic information, and then auto-create appc.json file, and then publish the module into registry.","",0,0,1,0,0,0,0,0,1,0,0,0,0,0
"CLI-762","08/10/2015 20:01:52",5,"Publish titanium project templates to Marketplace The appc-cli currently supports publishing only Arrow services to registry. It has to add support for publishing project templates into registry.    Users should be able to publish any existing titanium project as a template to Marketplace. If the root directory of the project already contains appc.json file specifying the type as 'template', then it should be able to publish the component to Marketplace, or if some information is missing, then appc-cli should prompt while the user is trying to publish.","",0,0,1,0,0,0,0,0,1,0,0,0,0,0
"CLI-765","08/13/2015 01:01:39",1,"""appc new --type app"" is not available in the Appc CLI *Details:* {{appc new --type app}} is not available in the Appc CLI.    *Note:* The following {{--type}} values are available in the Titanium CLI:      *Steps to reproduce:*  # In Appc CLI, run: {{appc new --type app}}    *Actual:* {{Unable to find plugin for project type ""app""}} error appears:      *Expected:* {{appc new --type app}} should be available.","  Create --type=app Options:     --id <value>                  the App ID in the format 'com.companyname.appname'     --template <value>            the name of the project template, path to template dir, path to zip                                   file, or url to zip file  [default: default]     -d, --workspace-dir <value>   the directory to place the project in     -n, --name <value>            the name of the project     -p, --platforms <value>       one or more target platforms.  [all, android, mobileweb, iphone,                                   ipad, windows]     -u, --url <value>             your company/personal URL     Create --type=applewatch Options:     --template <value>          the name of the project template, path to template dir, path to zip                                 file, or url to zip file  [default: watchos1]     -d, --project-dir <value>   the directory containing the project  [default: .]     -n, --name <value>          the name of the watch app     Create --type=module Options:     --id <value>                  the App ID in the format 'com.companyname.appname'     --template <value>            the name of the project template, path to template dir, path to zip                                   file, or url to zip file  [default: default]     -d, --workspace-dir <value>   the directory to place the project in     -n, --name <value>            the name of the project     -p, --platforms <value>       one or more target platforms.  [all, android, mobileweb, ios,                                   windows]    ERROR  | Error: unable to find plugin for project type ""app""      at validatePluginType (/Users/wluu/.appcelerator/install/4.2.0-44/package/lib/commands/new.js:70:22)      at _new.async.series.plugin (/Users/wluu/.appcelerator/install/4.2.0-44/package/lib/commands/new.js:79:12)      at /Users/wluu/.appcelerator/install/4.2.0-44/package/node_modules/async/lib/async.js:607:21      at /Users/wluu/.appcelerator/install/4.2.0-44/package/node_modules/async/lib/async.js:246:17      at iterate (/Users/wluu/.appcelerator/install/4.2.0-44/package/node_modules/async/lib/async.js:146:13)      at /Users/wluu/.appcelerator/install/4.2.0-44/package/node_modules/async/lib/async.js:157:25      at /Users/wluu/.appcelerator/install/4.2.0-44/package/node_modules/async/lib/async.js:248:21      at /Users/wluu/.appcelerator/install/4.2.0-44/package/node_modules/async/lib/async.js:612:34      at /Users/wluu/.appcelerator/install/4.2.0-44/package/lib/commands/new.js:43:12      at /Users/wluu/.appcelerator/install/4.2.0-44/package/lib/registry.js:233:10  ",0,1,0,0,1,0,0,0,0,0,0,0,0,0
"CLI-767","08/13/2015 01:56:09",3,"""Missing required option: --id <value>"" error is returned if you specify all the required flags to create an app *Details:* {{Missing required option: --id <value>}} error is returned if you specify all the required flags to create an app.    *Steps to reproduce:*  # Run the following command:  {{appc new --type titanium --subtype new  --platforms iphone --id com.appcelerator.testing --name monkey --project-dir ~/monkey  --url http:// --log-level trace}}    *Actual:* {{Missing required option: --id <value>}} error will appear:      *Expected:* No errors should appear.","  Missing required option: --id <value>    done with plugin [Error: titanium exited with non-zero exit code (1)]  ERROR  | Error: titanium exited with non-zero exit code (1)      at ChildProcess.<anonymous> (/Users/wluu/.appcelerator/install/4.1.3-1/package/node_modules/appc-cli-titanium/plugins/new.js:191:21)      at ChildProcess.emit (events.js:98:17)      at Process.ChildProcess._handle.onexit (child_process.js:820:12)  ",0,1,0,0,1,0,0,0,0,0,0,0,0,0
"CLI-768","08/13/2015 02:35:11",8,"Alloy app fails to build on window's with error ""Alloy compiler failed"" *This is a regression. Builds successfully with 4.1.2, 4.2.0-1 appc CLI. Did not check all the versions of the 4.2.0-X CLI as there are a lot. Went back till 4.2.0-40 & it failed. The build fails with 4.1.3-1 appc CLI as well.*    h6. Created this ticket In Unified CLI project as building with older CLI works fine. Please move to other project if suitable.    h5.Steps To Reproduce:  1. Create an alloy project on windows machine. (I used win 8.1 64 bit).  2. Build the app for windows or android.    h5.Actual Result:  1. The alloy compiler fails:      h5.Expected Results:  1. The alloy app build successfully on windows.","  [DEBUG] Titanium SDK Android directory: C:\ProgramData\Titanium\mobilesdk\win32\4.2.0.v20150812161221\android  [DEBUG] App ID: com.app.alloy  [DEBUG] Classname: Alloy  [INFO]  Executing Alloy compile: cmd /s /c C:\Users\Steve Ballmer\.appcelerator\install\4.1.3-1\package\node_modules\appc-cli-titanium\node_modules\.bin\alloy compile C:\Users\Steve Ballmer\Desktop\alloy\app --config platform=android,version=0,simtype=none,dev  icefamily=none,deploytype=development,target=emulator  '""C:\Users\Steve Ballmer\.appcelerator\install\4.1.3-1\package\node_modules\appc-cli-titanium\node_modules\.bin\alloy""' is not recognized as an internal or external command,  operable program or batch file.  [ERROR] Alloy compiler failed  TRACE  | titanium exited with exit code 1  ERROR  | Error: ti run exited with error code 1      at ChildProcess.<anonymous> (C:\Users\Steve Ballmer\.appcelerator\install\4.1.3-1\package\node_modules\appc-cli-titanium\plugins\run.js:89:66)      at ChildProcess.emit (events.js:98:17)      at Process.ChildProcess._handle.onexit (child_process.js:820:12)  ",0,1,0,0,0,1,0,0,0,0,0,0,0,0
"CLI-774","08/17/2015 04:29:17",8,"Support for WatchOS2 project in appc With the latest Titanium CLI and SDK, we are finally able to build watch OS2 apps. We need *appc new* and *appc run* to support the following:    To create a watch OS 2 and titanium Project, follow these steps:  1. Create a new project: ti create --type app --name foo --id com.appc.foo --platforms all --url http://foo --workspace-dir .  2. cd into the project: cd foo  3. Add a WatchKit 2 app: ti create --type applewatch --name bar --template watchos2  4. Build the app: ti build -p ios -I 9.0 --launch-watch-app","",0,1,0,0,0,1,0,0,0,0,0,0,0,0
