"issuekey","created","storypoint","context","codesnippet","t_Improvement","t_Bug","t_New.Feature","t_Story","c_Core","c_Titanium","c_Security","c_Verification","c_Registry","c_CLI","c_Installer","c_Node.Utilities","c_Documentation","c_Markdown"
"CLI-869","11/03/2015 19:07:14",5,"In preprod, you cannot import a mobile project with a non-platform guid *Details:* In preprod, you cannot import a mobile project with a non-platform guid.    *Notes:*  * If you point the current 5.1.0 stack to production, you cannot reproduce this issue.  * The *workaround* is to create another mobile project in preprod and use that project's guid.  * Even though importing a mobile project a non-platform guid works in production and a workaround is available, *this makes testing in preprod with AppcStudio very difficult.*    *Steps to reproduce:*  # Download and unzip XMLModule.zip  # Make sure you are pointing to *preprod*  # Run: {{appc new --import --project-dir <PATH_TO>/XMLModule -l trace}}    *Actual:* You will not be able to import the project. Login required error will be returned:      *Expected:* Should be able to import a mobile project with a non-platform guid in preproduciton.","  MonkeyLord:XML wluu$ ls  QE Automator XMLModule XML_timob8953  MonkeyLord:XML wluu$ appc new --import --project-dir XMLModule -l trace  Appcelerator Command-Line Interface, version 5.1.0-42  Copyright (c) 2014-2015, Appcelerator, Inc.  All Rights Reserved.    __command__ search paths:  [    ""/Users/wluu/.appcelerator/install/5.1.0-42/package"",    ""/Users/wluu/.appcelerator/install/5.1.0-42/package/node_modules"",    ""/Users/wluu/fromGit/qe-FeatureTest/XML/node_modules"",    ""/Users/wluu/fromGit/qe-FeatureTest/node_modules"",    ""/Users/wluu/fromGit/node_modules"",    ""/Users/wluu/node_modules"",    ""/Users/node_modules"",    ""/node_modules"",    ""/Users/wluu/.appcelerator/.npm/lib/node_modules""  ]  [PLUGIN-LOAD] 1ms /Users/wluu/.appcelerator/install/5.1.0-42/package/appc.js  [PLUGIN-LOAD] 380ms /Users/wluu/.appcelerator/install/5.1.0-42/package/node_modules/appc-cli-titanium/appc.js  [PLUGIN-LOAD] 1ms /Users/wluu/.appcelerator/install/5.1.0-42/package/node_modules/arrow/appc.js  log level set to ""trace""  executing command ""new""  Preproduction Environment Active    set environment to {""registry"":""https://software-preprod.cloud.appctest.com"",""security"":""https://security-preprod.cloud.appctest.com"",""baseurl"":""https://360-preprod.cloud.appctest.com""}  checking credentials for existing session  Attempting to load session info from config file  check if session is invalidated  session expiry 1447181641060 false  Arrow Cloud config file: /Users/wluu/.acs  found Arrow Cloud login { mid: '3e8e500eed0014075e9a77f8d20f588530f37118',    publishPort: 443,    publishHost: 'https://admin.cloudapp-enterprise-preprod.appctest.com',    username: 'wluu@appcelerator.com',    cookie: [ 'connect.sid=s%3AJRKPO6kCgw4GA0cj7eNvvZVY.6Tz85LOBa79BUXRkKNT7numEiyaJWBA6cQwz%2FHpjHTo; Path=/; Expires=Tue, 17 Nov 2015 18:54:34 GMT; HttpOnly' ],    defaultEP:      { publishHost: 'https://admin.cloudapp-enterprise-preprod.appctest.com',       publishPort: 443 } } , checking nodeACSEndpoint= https://admin.cloudapp-enterprise-preprod.appctest.com  Arrow Cloud cookie expiry [ 1447786474000 ]  session already loaded in opts.session  getCredentials() session:  {    ""ipaddress"": ""10.0.12.200"",    ""username"": ""wluu@appcelerator.com"",    ""password"": ""<OMITTED>"",    ""session"": ""<OMITTED>"",    ""nonce"": ""<OMITTED>"",    ""environment"": {      ""name"": ""production"",      ""isProduction"": true,      ""acsBaseUrl"": ""https://preprod-api.cloud.appctest.com"",      ""acsAuthBaseUrl"": ""https://dolphin-secure-identity.cloud.appcelerator.com"",      ""nodeACSEndpoint"": ""https://admin.cloudapp-enterprise-preprod.appctest.com""    },    ""token"": ""<OMITTED>"",    ""fingerprint"": ""3e8e500eed0014075e9a77f8d20f588530f37118"",    ""fingerprint_description"": ""Mac OSX Serial Number: C02JG4WDDV35"",    ""org_id"": 100001711,    ""expiry"": 1447181641060  }  loading plugins for command ""new""  new search paths:  [    ""/Users/wluu/.appcelerator/install/5.1.0-42/package"",    ""/Users/wluu/.appcelerator/install/5.1.0-42/package/node_modules"",    ""/Users/wluu/fromGit/qe-FeatureTest/XML/node_modules"",    ""/Users/wluu/fromGit/qe-FeatureTest/node_modules"",    ""/Users/wluu/fromGit/node_modules"",    ""/Users/wluu/node_modules"",    ""/Users/node_modules"",    ""/node_modules"",    ""/Users/wluu/.appcelerator/.npm/lib/node_modules""  ]  [PLUGIN-LOAD] 0ms /Users/wluu/.appcelerator/install/5.1.0-42/package/appc.js  [PLUGIN-LOAD] 126ms /Users/wluu/.appcelerator/install/5.1.0-42/package/node_modules/appc-cli-titanium/appc.js  new plugin: /Users/wluu/.appcelerator/install/5.1.0-42/package/node_modules/appc-cli-titanium  [PLUGIN-LOAD] 0ms /Users/wluu/.appcelerator/install/5.1.0-42/package/node_modules/arrow/appc.js  new plugin: /Users/wluu/.appcelerator/install/5.1.0-42/package/node_modules/arrow  loading plugin ""titanium"" for command ""new"" CLI options via function  loading plugin ""arrow"" for command ""new"" CLI options via array  Duplicate option ""name"" for command ""new"", removing...  Duplicate option ""force"" for command ""new"", removing...  Duplicate option ""services"" for command ""new"", removing...  Duplicate option ""colors"" for command ""new"", removing...  executing command ""new"" with the following plugins:  [""titanium"",""arrow""]  Attempting to load session info from config file  check if session is invalidated  session expiry 1447181641060 false  session already loaded in opts.session  ""/usr/local/bin/node"" ""/Users/wluu/.appcelerator/install/5.1.0-42/package/node_modules/appc-cli-titanium/node_modules/titanium/bin/titanium"" sdk -o json  checking for titanium, result:   { activeSDK: '5.1.0.v20151028190028',    defaultInstallLocation: '/Users/wluu/Library/Application Support/Titanium',    installLocations:      [ '/Users/wluu/Library/Application Support/Titanium',       '/Library/Application Support/Titanium' ],    installed:      { '5.1.0.v20151028190028': '/Users/wluu/Library/Application Support/Titanium/mobilesdk/osx/5.1.0.v20151028190028',       '5.0.2.GA': '/Users/wluu/Library/Application Support/Titanium/mobilesdk/osx/5.0.2.GA' },    sdks:      { '5.1.0.v20151028190028':         { name: '5.1.0.v20151028190028',          manifest: [Object],          path: '/Users/wluu/Library/Application Support/Titanium/mobilesdk/osx/5.1.0.v20151028190028' },       '5.0.2.GA':         { name: '5.0.2.GA',          manifest: [Object],          path: '/Users/wluu/Library/Application Support/Titanium/mobilesdk/osx/5.0.2.GA' } } }  after provision start app  after provision app Titanium SDK (JavaScript) titanium  titanium provisioned called app  after provision start completed  after provision completed Titanium SDK (JavaScript) titanium  titanium provisioned called completed  calling App.find on guid  2405184a-8944-4a4c-ba16-d25f9e2cb025  Unable to register the new app with Appcelerator Platform either due to limited connectivity or other unexpected problem. Please retry later using the command 'appc new --import --project-dir /path/to/project' { [Error: Login Required]    success: false,    description: 'Login Required',    code: 401,    internalCode: undefined }  done with plugin undefined    *** new completed. ***    MonkeyLord:XML wluu$ appc whoami  Appcelerator Command-Line Interface, version 5.1.0-42  Copyright (c) 2014-2015, Appcelerator, Inc.  All Rights Reserved.    Preproduction Environment Active    wluu@appcelerator.com in organization qe_test_org_preprod_enterprise (100001711)  MonkeyLord:XML wluu$   ",0,1,0,0,1,0,0,0,0,0,0,0,0,0
"CLI-871","11/06/2015 00:49:37",5,"Improve the download payload of appc-cli package by de-duping modules Currently some modules like appc-platform-sdk are referenced at multiple instances, and there is no need to have multiple copies of same module.     The build should run {{npm dedupe}} before shrinkwrap, so that it will aggregate into a higher package level.","",1,0,0,0,1,0,0,0,0,0,0,0,0,0
"CLI-874","11/10/2015 02:50:05",3,"include acs 1.0.31 acs cli 1.0.30 had to be removed because it was published with code from master instead of 1.3.1. we republished 1.0.31. appc cli needs to be updated as well. ","",0,0,0,1,1,0,0,0,0,0,0,0,0,0
"CLI-875","11/11/2015 20:09:32",5,"appc use command should allow --prerelease option {{appc use}} command will receive only stable versions by default. If the user wants to pull prerelease versions as well as part of appc use command, then they should use a new option such as {{--prerelease}}.","",0,0,1,0,1,0,0,0,0,0,0,0,0,0
"CLI-881","11/16/2015 22:33:58",2,"If you create an Arrow project with European character sets, then the next prompt will be ""What is the api name?"" *Details:* If you create an Arrow project with European character sets, then the next prompt will be ""What is the api name?"".    *Steps to reproduce:*  # In terminal, run {{appc new}}  # Select Arrow App  # Create a project name with European characters like umlaut u    *Actual:* ""What is the api name?"" prompt appears; see attachment.  *Expected:* The ""What is the api name?"" prompt should not appear when you create an Arrow project.","",0,1,0,0,1,0,0,0,0,0,0,0,0,0
"CLI-882","11/16/2015 22:39:04",5,"Cannot create an Arrow project with DEBUG=* and -l trace *Details:* Cannot create an Arrow project with DEBUG=* and -l trace.    *Note:* This is a *regression* from 5.0.4 core.    *Steps to reproduce:*  # In terminal, run {{DEBUG=* appc new -l trace}}  # Select Arrow App  # Specify a name for your project    *Actual:* Arrow project will fail to be created:      *Expected:* You should be able to create an Arrow project with DEBUG=* and -l trace.","  2015-11-16T21:57:59.545Z | ERROR  | ReferenceError: ejs:5      3|     ""description"":""<%=description%>"",      4|     ""version"": ""1.0.0"",   >> 5|     ""author"": ""<%=author%>"",      6|     ""license"": """",      7|     ""framework"": ""none"",      8|     ""keywords"": [    author is not defined      at eval (eval at <anonymous> (/Users/wluu/.appcelerator/install/5.1.0-58/package/node_modules/ejs/lib/ejs.js:464:12), <anonymous>:17:23)      at returnedFn (/Users/wluu/.appcelerator/install/5.1.0-58/package/node_modules/ejs/lib/ejs.js:493:17)      at Object.exports.render (/Users/wluu/.appcelerator/install/5.1.0-58/package/node_modules/ejs/lib/ejs.js:315:37)      at copyFile (/Users/wluu/.appcelerator/install/5.1.0-58/package/node_modules/arrow/lib/command/new.js:322:13)      at copyFileCallback (/Users/wluu/.appcelerator/install/5.1.0-58/package/node_modules/arrow/lib/command/new.js:305:6)      at Array.forEach (native)      at readdirCallback (/Users/wluu/.appcelerator/install/5.1.0-58/package/node_modules/arrow/lib/command/new.js:299:13)      at /Users/wluu/.appcelerator/install/5.1.0-58/package/node_modules/wrench/lib/wrench.js:108:13      at FSReqWrap.oncomplete (fs.js:82:15)    appc:run signal received +1m exit sending to ChildProcess {    domain: null,    _events: { close: [Function] },    _eventsCount: 1,    _maxListeners: undefined,    _closesNeeded: 1,    _closesGot: 1,    connected: false,    signalCode: null,    exitCode: 1,    killed: false,    spawnfile: '/usr/local/bin/node',    _handle: null,    spawnargs:      [ '/usr/local/bin/node',       '/Users/wluu/.appcelerator/install/5.1.0-58/package/bin/appc',       'new',       '-l',       'trace' ],    pid: 11121,    stdin: null,    stdout: null,    stderr: null,    stdio: [ null, null, null ] }  ",0,1,0,0,1,0,0,0,0,0,0,0,0,0
"CLI-885","11/18/2015 22:45:59",1,"Appc new should be more cautious when unable to read Ti activeSDK value When appc new failed to retrieve active Ti SDK version, following error occurred with the command {{appc new}}        h5. Reproduce steps  1. appc use 5.1.0  2. remove/rename {{.titanium/config.json}}  3. remove/rename {{Application Support/Titanium/mobilesdk}}  4. appc new    h5. Expected  result  you should see the following prompt instead of the undefined error      h5. Actual result  Project type selection prompt is not shown, and process errors out:  {{ERROR  | Cannot read property 'split' of undefined}}      ","  ERROR  | Cannot read property 'split' of undefined    ? What type of project are you creating? (Use arrow keys)  ❯ Native App     Arrow App     Titanium Module   ",0,1,0,0,0,1,0,0,0,0,0,0,0,0
"CLI-889","11/19/2015 22:20:02",5,"Windows: Using Node 4.2.2 32-bit results in failure to login h5. Description:  NOT a regression, as this occurs with CLI 5.0.4.GA as well.  DOES NOT occur with Node 4.2.2 64-bit    While trying to login on Windows with Node 4.2.2 installed, after org selection we get an error:        h5. Steps to reproduce:  1) Install Node 4.2.2 32-bit on a windows machine  2) Run {{appc login}}  3) Enter credentials and select an org    h5. Result:  Failure as see above    h5. Expected Result:  Successful login"," { [Error: tunneling socket could not be established, cause=connect ECONNREFUSED 127.0.0.1:80] code: 'ECONNRESET' }  2015-11-19T21:22:37.199Z | ERROR  | Error: tunneling socket could not be established, cause=connect ECONNREFUSED 127.0.0.1:80      at ClientRequest.onError (C:\Users\Steve Ballmer\.appcelerator\install\5.1.0-60\package\node_modules\request\node_modules\tunnel-agent\index.js:174:17)      at ClientRequest.g (events.js:260:16)      at emitOne (events.js:77:13)      at ClientRequest.emit (events.js:169:7)      at Socket.socketErrorListener (_http_client.js:259:9)      at emitOne (events.js:77:13)      at Socket.emit (events.js:169:7)      at emitErrorNT (net.js:1253:8)      at doNTCallback2 (node.js:441:9)      at process._tickCallback (node.js:355:17)  ",0,1,0,0,1,0,0,0,0,0,0,0,0,0
"CLI-893","12/01/2015 20:01:24",8,"CLI fails to find core dependencies, incorrect location.  h5. Description:  Appc CLI fails to find the core dependencies as they are not located in the correct path:       When checking the node_modules folder under apps-cli-titanium, the following modules are missing: {{alloy , titanium , appc-security , node-appc}}    h5. Steps to reproduce:  1. appc use 5.2.0-131  2. navigate to cli folder ( Default location on OSX: {{/Users/harrybryant/.appcelerator/install/5.2.0-131/package/node_modules/appc-cli-titanium/node_modules}} )  3. compare the above list of required modules to the modules found in the path location from step 2.    h5. Result:  Missing modules: {{alloy , titanium , appc-security , node-apps}}    h5. Expected Result:  Missing modules should be placed under path: {{/Users/harrybryant/.appcelerator/install/5.2.0-131/package/node_modules/appc-cli-titanium/node_modules}}","  module.exports = {      'appc-cli-titanium': [          'alloy',          'titanium',          'appc-security',          'appc-platform-sdk',          'appc-inquirer',          'node-appc'      ],  ",0,1,0,0,1,0,0,0,0,0,0,0,0,0
"CLI-895","12/02/2015 18:54:58",5,"CLI should not honor invalid url in proxy settings Studio might be writing down an invalid URL in the proxy configuration such as {{""proxyServer"": ""https://null”}}    CLI should not attempt to make a connection using this invalid URL, and it should rather attempt to remove the URL from its configuration.","",0,1,0,0,1,0,0,0,0,0,0,0,0,0
"CLI-898","12/04/2015 02:32:26",0,"In production, ""appc use"" should not display all 100 published cores in a list *Details:* Currently in production, if you run {{appc use}}, 100 published cores are displayed in a list:      This seems very unsightly and overwhelming. To make the list seem more manageable:  * The list should only display the latest ten published cores like before.  * *Or,* the list should be displayed in multiple columns.  * *Or,* there should be a pagination system either through flags or interactive prompting.","  MonkeyLord:~ wluu$ appc use  The following versions are available:    5.2.0-55   Not Installed                             5.1.0      Installed (Latest) (Active)               5.0.4      Installed                                 5.0.3      Not Installed                             5.0.2      Not Installed                             5.0.1      Not Installed                             5.0.0      Not Installed                             4.1.3      Not Installed                             4.1.2      Not Installed                             4.1.1      Not Installed                             4.1.0      Not Installed                             5.0.0-50   Not Installed                             5.0.0-40   Not Installed                             4.0.2      Not Installed                             4.1.0-0    Not Installed                             4.0.1      Not Installed                             4.0.0      Not Installed                             4.0.0-rc   Not Installed                             1.2.123    Not Installed                             0.2.285    Not Installed                             0.2.283    Not Installed                             0.2.282    Not Installed                             0.2.276    Not Installed                             0.2.273    Not Installed                             0.2.255    Not Installed                             0.2.247    Not Installed                             0.2.246    Not Installed                             0.2.242    Not Installed                             0.2.241    Not Installed                             0.2.230    Not Installed                             0.2.229    Not Installed                             0.2.228    Not Installed                             0.2.227    Not Installed                             0.2.226    Not Installed                             0.2.225    Not Installed                             0.2.224    Not Installed                             0.2.223    Not Installed                             0.2.222    Not Installed                             0.2.221    Not Installed                             0.2.220    Not Installed                             0.2.219    Not Installed                             0.2.218    Not Installed                             0.2.217    Not Installed                             0.2.216    Not Installed                             0.2.215    Not Installed                             0.2.214    Not Installed                             0.2.213    Not Installed                             0.2.212    Not Installed                             0.2.210    Not Installed                             0.2.209    Not Installed                             0.2.208    Not Installed                             0.2.207    Not Installed                             0.2.204    Not Installed                             0.2.203    Not Installed                             0.2.201    Not Installed                             0.2.200    Not Installed                             0.2.199    Not Installed                             0.2.198    Not Installed                             0.2.198    Not Installed                             0.2.197    Not Installed                             0.2.196    Not Installed                             0.2.195    Not Installed                             0.2.192    Not Installed                             0.2.191    Not Installed                             0.2.187    Not Installed                             0.2.186    Not Installed                             0.2.185    Not Installed                             0.2.183    Not Installed                             0.2.182    Not Installed                             0.2.181    Not Installed                             0.2.181    Not Installed                             0.2.180    Not Installed                             0.2.179    Not Installed                             0.2.178    Not Installed                             0.2.177    Not Installed                             0.2.176    Not Installed                             0.2.175    Not Installed                             0.2.174    Not Installed                             0.2.173    Not Installed                             0.2.172    Not Installed                             0.2.170    Not Installed                             0.2.169    Not Installed                             0.2.101    Not Installed                             0.2.101    Not Installed                             0.2.101    Not Installed                             0.2.100    Not Installed                             0.2.99     Not Installed                             0.2.98     Not Installed                             0.2.97     Not Installed                             0.2.96     Not Installed                             0.2.95     Not Installed                             0.2.46     Not Installed                             0.2.45     Not Installed                             0.2.45     Not Installed                             0.2.44     Not Installed                             0.2.43     Not Installed                             0.2.42     Not Installed                             0.2.41     Not Installed                             0.2.40     Not Installed                             0.2.39     Not Installed                   ",1,0,0,0,1,0,0,0,0,0,0,0,0,0
"CLI-899","12/04/2015 19:08:28",5,"Components being published with prerelease option should match version format m.m.p-x The components such as appc-cli can now be published with prerelease option even with a version such as 4.0.0. However, according to the prerelease semantic versioning policy, the components should match version format m.m.p-x for being published with prerelease option.    If the version is not matched with that format, then CLI should throw error message and should not publish.","",0,0,0,1,1,0,0,0,0,0,0,0,0,0
"CLI-901","12/07/2015 13:20:31",3,"Windows: appc-ti stdio can sometimes not register input On Windows, I found when attempting to switch SDKs using:        That my input was not registered and my SDK was never changed.    Although the documentation for [stdio|https://nodejs.org/api/child_process.html#child_process_options_stdio] says _inherit_ is the same as _process.stdin/stdout_, replacing the current {{[process.stdin, process.stdout, 'pipe']}} with {{['inherit', 'inherit', 'pipe']}} solves the problem.  ","  appc ti sdk select  ",0,1,0,0,0,1,0,0,0,0,0,0,0,0
"CLI-908","12/11/2015 21:28:44",3,"NPM 3 Flat node_modules Breaks CLI cli and appc-cli-titanium, at the very least, have paths inside of them that depend on nested node_modules. With npm 3, all of the dependencies and their dependencies are flatly stored in the one node_modules directory, which breaks these references in our code. We need to be less brittle with these references.    To reproduce, I am able to simply `appc use 5.2.0-155`, then try to do something like `appc ti clean` and you should see an error about not being able to find `node_modules/appc-cli-titanium/node_modules/titanium/bin/titanium`.","",0,1,0,0,1,0,0,0,0,0,0,0,0,0
"CLI-914","12/29/2015 20:29:56",2,"Jailbreak detection fails with <property name=""appc-sourcecode-encryption-policy"" type=""string"">embed</property> An application will launch on a jailbroken device with the following property:      *Expected behavior*  Application closes or displays security exception splash screen    *Actual behavior*  Application loads regardless of jailbroken state    *Tested against the following*  iPhone 6 @ 9.0.2 fails to detect JB with embed policy  iPhone 4s @ 7.1.0 fails to detect JB with embed policy    *SDK and environment*  appc ti sdk  -> 5.1.1.GA  tiapp.xml sdk -> 5.1.1.GA    *Steps to test*  1) Open test app // vanilla alloy application  2) Add valid GUID  3) run   4) Record if the app launches on a jailbroken device     *Attached files*  Example application // guid stripped from tiapp.xml  ","  <property name=""appc-sourcecode-encryption-policy"" type=""string"">embed</property>   appc run -p ios -T device ",1,0,0,0,0,1,0,0,0,0,0,0,0,0
"CLI-921","01/14/2016 19:28:37",5,"Appc alloy -v returns error When trying to run {{appc alloy -v}} I get the below error      *Steps to reproduce issue*  1. Run {{appc alloy -v}}    *Actual results*  I get the above error    *Expected results*  My alloy version is returned","  Cannot find expected binary at /Users/Eric/.appcelerator/install/5.2.0-220/package/node_modules/appc-cli-titanium/node_modules/alloy/bin/alloy. This likely means the install package at /Users/Eric/.appcelerator/install/5.2.0-220/package is invalid for version 5.2.0-220 [com.appcelerator.install.binary.missing]  ",0,1,0,0,1,0,0,0,0,0,0,0,0,0
