"issuekey","created","storypoint","context","codesnippet","t_Task","t_Story","t_Bug","t_New.Feature","c_Schema","c_CRUD","c_Real.Time.Server.Stats","c_UI...UX","c_Document.Validation","c_Stability","c_Query.Bar","c_First.Run","c_Connectivity","c_DDL","c_Performance","c_Research...Design","c_Plugins","c_Packaging","c_Navigation","c_Misc","c_Compass","c_Query","c_Electron","c_Auto.Updates","c_Export.to.Language","c_Aggregation.pipeline","c_Metrics","c_Grammar","c_Tech.debt","c_Intercom","c_Atlas","c_Telemetry.Data","c_Installation","c_CI","c_Language.Modes","c_Blog","c_schema.rs","c_Build","c_Favorites","c_Security","c_Explain","c_Webpack","c_React","c_Collection","c_Header","c_Sidebar","c_Views","c_Windows.Installer","c_Release","c_Maps","c_Import.Export"
"COMPASS-167","09/12/2016 02:16:50",3,"Re-implement ""open ranges"" behavior in reactified schema view ""For MongoDB World, we've implemented a behavior in the query builder on """"number"""" minicharts to create open ranges, e.g. {{\{""""$lt"""": 20\}}} instead of {{\{""""$gt"""": 15, """"$lt"""": 20\}}} (special request from Dana for the demo). The behavior was to click-drag the selection box over the edge of the chart to trigger the open range, while still allowing closed ranges when dragging close to the edge.    !open_closed_ranges_query_builder.gif|width=600!    This behavior got lost in the transition to the React version of the schema in the 1.4.0-beta cycle.    We want to re-implement it, and also add subtle visual feedback that indiciates to the user that they have reached/passed the threshold between open/close ranges (e.g. a faded background to the side when switching to open range).    The implementation for this behavior is available in the old code base, but it needs to be adjusted to the new query builder code.     Code Snippets:    - Detection of mouse outside chart in the old code base: https://github.com/10gen/compass/blob/1.3-releases/src/app/minicharts/d3fns/many.js#L89-L98 ({{openLeft}}, {{openRight}} boolean flags)    - Code in the old Query Builder to handle open ranges: https://github.com/10gen/compass/blob/1.3-releases/src/app/minicharts/querybuilder.js#L292-L306 (probably not relevant, just adding for completeness).    - Somewhere in here we need to add the """"outside chart"""" detection and construct the open query, and pass it to the {{setRangeValue}} action, see below. https://github.com/10gen/compass/blob/master/src/internal-packages/schema/lib/d3/many.js#L85-L108    - New Query Builder action {{setRangeValue}} already supports open ranges, just need to be called correctly: https://github.com/10gen/compass/blob/f05b3acf40fe9e56691aedd83cd7d970a9a84420/src/internal-plugins/query/lib/store/query-store.js#L564-L593    Acceptance criteria:  * add """"outside chart"""" implementation for minicharts  * call {{setRangeValue}} in query store         ""","",1,0,0,0,1,0,0,0,0,0,0,0,0,0,0,0,0,0,0,0,0,0,0,0,0,0,0,0,0,0,0,0,0,0,0,0,0,0,0,0,0,0,0,0,0,0,0,0,0,0,0
"COMPASS-65","10/04/2016 17:06:38",3,"CRUD: Improve Date Editing ""- Add help section explaining types that can be converted to dates. Format example MUST be one of yyyy-mm-dd, yyyy-mm-ddThh:MM:SS, yyyy-mm-ddThh:MM:SS.SSS. Note: Date formats were expanded to a much larger set by using the Date constructor in COMPASS-919.  - Render the dates in the same format that can be accepted: yyyy-mm-ddThh:MM:SS.SSS      ""","",1,0,0,0,0,1,0,0,0,0,0,0,0,0,0,0,0,0,0,0,0,0,0,0,0,0,0,0,0,0,0,0,0,0,0,0,0,0,0,0,0,0,0,0,0,0,0,0,0,0,0
"COMPASS-115","10/08/2016 20:15:19",5,"As a developer I want to show dates in server time and not local (laptop) time ""h5. Story  As a developer, I want Compass to show date values in server time and not converted to the local (laptop) time so that I confirm that my application is saving dates correctly.    h5. User anecdote  More details:  With the current Compass implementation, I thought my App inserts dates with an offset of +1 day and I spent a lot of time trouble-shooting until I used the mongo shell and realized the dates are correct but Compass shows it converted to local time.    h5. Product Acceptance Criteria  * Have a menu option(s) to Show Dates as server time or local time  * Default to server time""","",0,1,0,0,0,0,1,0,0,0,0,0,0,0,0,0,0,0,0,0,0,0,0,0,0,0,0,0,0,0,0,0,0,0,0,0,0,0,0,0,0,0,0,0,0,0,0,0,0,0,0
"COMPASS-265","11/02/2016 15:29:49",5,"Find in Page ""Electron now has the bindings so """"Find in Page"""" (Cmd+F) is accessible to us: https://github.com/atom/electron/blob/master/docs/api/web-contents.md#webcontentsfindinpagetext-options    Note: this will involve UI for the search input, prev/next/close buttons.""","",1,0,0,0,0,0,0,1,0,0,0,0,0,0,0,0,0,0,0,0,0,0,0,0,0,0,0,0,0,0,0,0,0,0,0,0,0,0,0,0,0,0,0,0,0,0,0,0,0,0,0
"COMPASS-273","11/03/2016 14:42:41",5,"Field names should be available in doc validation pane ""When using the GUI document validation rule builder, it would be a lot simpler to use if it allowed you to select from the existing document field names rather than having to type them in.      Acceptance Criteria:  - Use the react-select component index field names (COMPASS-540) to wire it up to the field store (COMPASS-727)  - Add functional tests for adding field names to Document Validation  - Update existing enzyme tests to account for these changes""","",1,0,0,0,0,0,0,1,1,0,0,0,0,0,0,0,0,0,0,0,0,0,0,0,0,0,0,0,0,0,0,0,0,0,0,0,0,0,0,0,0,0,0,0,0,0,0,0,0,0,0
"COMPASS-274","11/03/2016 15:03:41",2,"Converting type names to numbers in doc validation rule builder makes JSON less readable ""I created doc validation rules using type names (see attached) but Compass then converts them to the numeric equivalent in the JSON output and the rule that's added to MongoDB. It would be simpler for people to understand the rules if Compass kept the name instead.    {code:title=rules.js|borderStyle=solid}  {    """"name"""": {      """"$type"""": 3    },    """"name.first"""": {      """"$type"""": 2    },    """"name.last"""": {      """"$type"""": 1    },    """"social.twitter"""": {      """"$type"""": 4    }  }    db.getCollectionInfos({name:""""people""""})  [   {    """"name"""" : """"people"""",    """"type"""" : """"collection"""",    """"options"""" : {     """"validator"""" : {      """"name"""" : {       """"$type"""" : 3      },      """"name.first"""" : {       """"$type"""" : 2      },      """"name.last"""" : {       """"$type"""" : 1      },      """"social.twitter"""" : {       """"$type"""" : 4      }     },     """"validationLevel"""" : """"strict"""",     """"validationAction"""" : """"error""""    },    """"info"""" : {     """"readOnly"""" : false    },    """"idIndex"""" : {     """"v"""" : 2,     """"key"""" : {      """"_id"""" : 1     },     """"name"""" : """"_id_"""",     """"ns"""" : """"clusterdb.people""""    }   }  ]  {code}      Scope of the ticket:     - change type value to its string alias  - change tests to reflect this""","  {    """"name"""": {      """"$type"""": 3    },    """"name.first"""": {      """"$type"""": 2    },    """"name.last"""": {      """"$type"""": 1    },    """"social.twitter"""": {      """"$type"""": 4    }  }    db.getCollectionInfos({name:""""people""""})  [   {    """"name"""" : """"people"""",    """"type"""" : """"collection"""",    """"options"""" : {     """"validator"""" : {      """"name"""" : {       """"$type"""" : 3      },      """"name.first"""" : {       """"$type"""" : 2      },      """"name.last"""" : {       """"$type"""" : 1      },      """"social.twitter"""" : {       """"$type"""" : 4      }     },     """"validationLevel"""" : """"strict"""",     """"validationAction"""" : """"error""""    },    """"info"""" : {     """"readOnly"""" : false    },    """"idIndex"""" : {     """"v"""" : 2,     """"key"""" : {      """"_id"""" : 1     },     """"name"""" : """"_id_"""",     """"ns"""" : """"clusterdb.people""""    }   }  ]  ",1,0,0,0,0,0,0,1,0,0,0,0,0,0,0,0,0,0,0,0,0,0,0,0,0,0,0,0,0,0,0,0,0,0,0,0,0,0,0,0,0,0,0,0,0,0,0,0,0,0,0
"COMPASS-290","11/07/2016 02:17:49",3,"Make sure all version comparisons use semver ""For server version comparisons (e.g. all 3.4-only features) we should use a library that can handle version numbers correctly, e.g. the """"semver"""" package.    Otherwise, we might run into issues with release candidates or other unusual version strings.    Simple string comparison fails in these cases:       But semver can handle this correctly:       One place where this happens:    https://github.com/10gen/compass/blob/d244de57b322ae4b3142c13220dec5191fafe0b9/src/internal-packages/crud/lib/component/editable-value.jsx#L73    Need to find all other places where we use simple string comparisons for versions.""","  > '3.4.0' > '3.4.0-rc3'  false    > semver.gt('3.4.0', '3.4.0-rc3')  true  ",1,0,0,0,0,0,0,0,0,1,0,0,0,0,0,0,0,0,0,0,0,0,0,0,0,0,0,0,0,0,0,0,0,0,0,0,0,0,0,0,0,0,0,0,0,0,0,0,0,0,0
"COMPASS-302","11/08/2016 23:44:32",1,"When the user wants to execute an empty query, pop up a warning box that this is not ideal ""Broken off from COMPASS-291 and should be implemented after that.    Show a modal popup to warn the user when they try to run an empty explain {} because that is potentially very expensive on the database and we already know the result: a collection scan.    Acceptance Criteria:     - When the user enters an empty query (or uses the default empty query) and hits apply, a modal window should appear with a warning text and 2 buttons, cancel/continue. Only when the user presses continue should the explain be executed.  ""","",1,0,0,0,0,0,0,0,0,0,1,0,0,0,0,0,0,0,0,0,0,0,0,0,0,0,0,0,0,0,0,0,0,0,0,0,0,0,0,0,0,0,0,0,0,0,0,0,0,0,0
"COMPASS-374","11/17/2016 15:36:38",1,"Make schema/query timings visible to the user ""- Dictate to the user the definition performance: """"You may think this was slow because you were also on a hangout""""  - Don't want to think UI bugs/performance in Compass mean Server is slow  - We track these as metrics but don't expose to user  - Time to sample on server|analyze|render|$sample used  - If sample time on server slow (use ms value for slow queries from profiler?)     - recommend viewing the explain plan to make it faster    - green|yellow|red color indication like mocha's slowms?""","",1,0,0,0,0,0,0,1,0,0,0,0,0,0,0,0,0,0,0,0,0,0,0,0,0,0,0,0,0,0,0,0,0,0,0,0,0,0,0,0,0,0,0,0,0,0,0,0,0,0,0
"COMPASS-457","11/28/2016 05:39:07",1,"Improve the Windows installer icon ""Presumably the installer icon should use the MongoDB leaf, not something that looks a bit like a black Christmas present box.    !Screen Shot 2016-11-28 at 4.36.12 pm.png|width=50%!    Windows builds are available on Evergreen, e.g.    https://evergreen.mongodb.com/task/10gen_compass_testing_windows_64_compile_0ebd7009f7403340abb53f6691bf0325793bd8e5_16_11_28_04_14_13""","",1,0,0,0,0,0,0,0,0,0,0,1,0,0,0,0,0,0,0,0,0,0,0,0,0,0,0,0,0,0,0,0,0,0,0,0,0,0,0,0,0,0,0,0,0,0,0,0,0,0,0
"COMPASS-506","12/04/2016 03:36:55",3,"Clear recent connections list from connect view ""Or remove individual connections.""","",1,0,0,0,0,0,0,0,0,0,0,0,1,0,0,0,0,0,0,0,0,0,0,0,0,0,0,0,0,0,0,0,0,0,0,0,0,0,0,0,0,0,0,0,0,0,0,0,0,0,0
"COMPASS-632","01/11/2017 03:36:36",5,"Support collation on Create Database & Collection dialogs ""Introduced in MongoDB 3.4:  https://docs.mongodb.com/master/release-notes/3.4/#collation-and-case-insensitive-indexes    MongoChef claims full collation support which Compass cannot today:  http://3t.io/blog/what-is-new-in-mongochef-4-5/""","",1,0,0,0,0,0,0,0,0,0,0,0,0,1,0,0,0,0,0,0,0,0,0,0,0,0,0,0,0,0,0,0,0,0,0,0,0,0,0,0,0,0,0,0,0,0,0,0,0,0,0
"COMPASS-723","01/28/2017 10:39:28",1,"Increase ssh tunnel connection timeouts ""We have a user in intercom complaining that he gets ssh timeouts, when RoboMongo connects to the instance ok.   Currently, the timeout is [hardcoded to 5 seconds|https://github.com/mongodb-js/connection-model/blob/2002a3df39658665ac9d6713ace525bd35bb2dcb/lib/model.js#L703-L705] in the connection-model. Increase to 30 seconds to account for geo latency. ""","",1,0,0,0,0,0,0,0,0,0,0,0,1,0,0,0,0,0,0,0,0,0,0,0,0,0,0,0,0,0,0,0,0,0,0,0,0,0,0,0,0,0,0,0,0,0,0,0,0,0,0
"COMPASS-820","02/27/2017 06:10:10",3,"Static assets all live under ./static ""This will improve the Windows installation experience in two ways: 1. Installation assets to be decompressed before installation begins 2. Installation assets trigger less activity like to be disrupted by a virus scanner   - Make a new {{./static}} directory - Move {{./src/app/{images,styles}}} and HTML files into {{./static}} - Update all image references in the app and hadron-build to point at {{./static}} - Update hadron-build to write {{./src/compiled-less}} to{{./static}} - Add {{./static}} to the {{asar.upack}} option in {{hadron-build/commands/release.js}} (they don’t need to be packed)  Also consider updating any timing code to use [~lucas.hrabovsky] suggestion: https://github.com/nolanlawson/marky  h3. References   - [N1 ./static|https://github.com/nylas/N1/tree/master/static] - [N1’s bootloader.js|https://github.com/nylas/N1/blob/master/static/index.js] - [Atom ./static|https://github.com/atom/atom/tree/master/static] - [Atom’s advanced bootloader.js|https://github.com/atom/atom/blob/master/static/index.js]  If all goes well, this will negate https://jira.mongodb.org/browse/COMPASS-415""","",1,0,0,0,0,0,0,0,0,0,0,0,0,0,1,0,0,0,0,0,0,0,0,0,0,0,0,0,0,0,0,0,0,0,0,0,0,0,0,0,0,0,0,0,0,0,0,0,0,0,0
"COMPASS-851","03/06/2017 07:32:12",2,"Investigate Kerberos Authentication if the username contains @  ""From COMPASS-745, it looks like Kerberos and X.509 are also likely to double-encode their auth-component in the same way LDAP does.    This ticket should:    1. Confirm if this is true, e.g. with https://docs.mongodb.com/v3.2/tutorial/control-access-to-mongodb-with-kerberos-authentication/    2. If so, add a regression test in connection-model.  3. Remove all redundant {{encodeURIComponent}} calls, including in comments to make it clearer that {{url.format}} already handles this even better than we could ([git blame|https://github.com/nodejs/node/blame/v6.3.1/lib/url.js#L557] reveals it has been [optimised for more performance|https://github.com/nodejs/node/commit/db9128135f382e22202d900263e872d8b48f0050]).""","",0,0,1,0,0,0,0,0,0,0,0,0,1,0,0,0,0,0,0,0,0,0,0,0,0,0,0,0,0,0,0,0,0,0,0,0,0,0,0,0,0,0,0,0,0,0,0,0,0,0,0
"COMPASS-909","03/14/2017 15:35:24",5,"Rename collection ""As the comments below indicate there are several feature requests to rename a collection. This can be achieved in the node driver by calling the [rename|http://mongodb.github.io/node-mongodb-native/2.2/api/Collection.html#rename] command on particular collection. The goal of this ticket is to add the UI element, probably an extra option in the sidebar next to ever collection field to edit and call the rename command on the selected collection.    Acceptance Criteria:  * add {{rename}} to data-service (https://github.com/mongodb-js/data-service)  * include unit tests for rename in data-service  * make UI element (On the sidebar) that can be clicked to produce a modal for renaming collection  * add enzyme tests for the above element  * add store action to rename collection that calls the above data-service method  * add unit tests for the above store action        ""","",0,0,0,1,0,0,0,0,0,0,0,0,0,1,0,1,0,0,0,0,0,0,0,0,0,0,0,0,0,0,0,0,0,0,0,0,0,0,0,0,0,0,0,0,0,0,0,0,0,0,0
"COMPASS-931","03/20/2017 07:53:05",3,"Spike: Research if/how Compass can be ""kerberized"" ""Reported by Barclays (00430436).    When connecting to a Kerberos authenticated MongoDB deployment using Compass, we must supply the password from the Compass UI. Ideally, Compass should use the context of the logged in user and hence a password should not be needed unless a different context/user is needed to connect to the MongoDB deployment.    This is how """"kerberized"""" applications usually behave, and while the current implementation works, it's unusual and unexpected for users used to work in a kerberos environment.    ""","",1,0,0,0,0,0,0,0,0,0,0,0,1,0,0,0,0,0,0,0,0,0,0,0,0,0,0,0,0,0,0,0,0,0,0,0,0,0,0,0,0,0,0,0,0,0,0,0,0,0,0
"COMPASS-1014","04/07/2017 12:06:40",3,"Unable to Enter Line Breaks in Strings ""User reporting on Intercom that they are unable to create line breaks in Strings in the Documents tab. """"\n"""" is getting escaped and we already override the Enter key functionality. Need to allow \n or provide a CTRL+Enter or similar to allow line breaks.""","",0,0,1,0,0,1,0,0,0,0,0,0,0,0,0,0,0,0,0,0,0,0,0,0,0,0,0,0,0,0,0,0,0,0,0,0,0,0,0,0,0,0,0,0,0,0,0,0,0,0,0
"COMPASS-1083","04/28/2017 17:58:30",3,"LUUID/NUUID/BinData support for filters ""Please see comments.""","",1,0,0,0,0,1,0,0,0,0,0,0,0,0,0,0,0,0,0,0,0,0,0,0,0,0,0,0,0,0,0,0,0,0,0,0,0,0,0,0,0,0,0,0,0,0,0,0,0,0,0
"COMPASS-1099","05/03/2017 19:01:09",8,"Move Databases DDL to External Plugin ""Move the databases-ddl internal package to the new compass-databases-ddl repo.    - Move all code from internal-packages/database-ddl to 10gen/compass-databases-ddl  - Use the khaos template to generate the plugin and make necessary changes to the template if problems arise.  - Move all databases-ddl tests from Compass to the compass-databases-ddl repo  - Add compass-databases-ddl to the compass-lite and compass-enterprise distribution configs in the package.json in Compass (for now)  - Remove internal-packages/databases-ddl""","",1,0,0,0,0,0,0,0,0,0,0,0,0,0,0,0,1,0,0,0,0,0,0,0,0,0,0,0,0,0,0,0,0,0,0,0,0,0,0,0,0,0,0,0,0,0,0,0,0,0,0
"COMPASS-1100","05/03/2017 19:07:22",8,"Move Database Plugin to External Plugin ""Move the database internal package to the new compass-collections-ddl repo.    - Move all code from internal-packages/database to 10gen/compass-collections-ddl  - Use the khaos template to generate the plugin and make necessary changes to the template if problems arise.  - Move all Database tests from Compass to the compass-collections-ddl repo  - Add compass-collections-ddl to the compass-lite and compass-enterprise distribution configs in the package.json in Compass (for now)  - Remove internal-packages/database""","",1,0,0,0,0,0,0,0,0,0,0,0,0,0,0,0,1,0,0,0,0,0,0,0,0,0,0,0,0,0,0,0,0,0,0,0,0,0,0,0,0,0,0,0,0,0,0,0,0,0,0
"COMPASS-1102","05/03/2017 19:39:30",5,"Move Explain to external package ""Move the explain internal package to the new compass-explain repo.    - Move all code from internal-packages/explain to 10gen/compass-explain  - Use the khaos template to generate the plugin and make necessary changes to the template if problems arise.  - Move all Validation tests from Compass to the compass-explain repo  - Add compass-explain to the compass-lite and compass-enterprise distribution configs in the package.json in Compass (for now)  - Remove internal-packages/explain""","",1,0,0,0,0,0,0,0,0,0,0,0,0,0,0,0,1,0,0,0,0,0,0,0,0,0,0,0,0,0,0,0,0,0,0,0,0,0,0,0,0,0,0,0,0,0,0,0,0,0,0
"COMPASS-1237","06/09/2017 17:03:49",8,"Add Installation Drive Destination Selection to Install Workflow on Windows ""A customer reported in [this coversation|https://app.intercom.io/a/apps/p57suhg7/respond/inbox/unassigned/conversations/10247108756] a desire to select to which drive Compass is installed. I then tested the workflow on a Windows 10 machine and was unable to select the drive to which I was installing.     I believe the ability to select the destination drive for the install to be a desirable addition to the workflow.""","",1,0,0,0,0,0,0,0,0,0,0,0,0,0,0,0,0,1,0,0,0,0,0,0,0,0,0,0,0,0,0,0,0,0,0,0,0,0,0,0,0,0,0,0,0,0,0,0,0,0,0
"COMPASS-1337","07/06/2017 08:58:47",3,"Make Doc Validation's Editable Component reusable across plugins ""Currently the Editable component resides in Doc Validation but it is a generic component that can be used throughout Compass.     It will be pulled over to Compass after COMPASS-1303 is done. The work remaining is:  - Remove the Editable component from [Doc Validation|https://github.com/10gen/compass-document-validation] and use the version from Compass via the appRegistry lifecycle methods  - Remove any !important flags in the {{editable.less}} file as it shouldn't be required anymore.    Acceptance criteria:  - Make sure Doc Validation UI remains the same  - Make sure Charts UI remains the same  ""","",1,0,0,0,0,0,0,0,1,1,0,0,0,0,0,0,0,0,0,0,0,0,0,0,0,0,0,0,0,0,0,0,0,0,0,0,0,0,0,0,0,0,0,0,0,0,0,0,0,0,0
"COMPASS-1404","07/12/2017 18:18:58",3,"Hook into Server Description Changed Events ""Currently deployment awareness listens to only topology description changed events, which does not cover the case when connected to a standalone instance. If a standalone server goes into an unknown state, the topology type remains as single according to the SDAM specification even though the server description becomes unknown.    Therefore, we must also listen to these events when connected in standalone mode and fire the same changes as the existing topology related events.    - Change https://github.com/10gen/compass-deployment-awareness/blob/master/src/stores/index.js to also listen to 'serverDescriptionChanged` events and trigger with an overwritten 'unknown' state instead of keeping the same 'single' type. The read state and write state stores should handle this accordingly.""","",1,0,0,0,0,0,0,0,0,0,0,0,1,0,0,0,0,0,0,0,0,0,0,0,0,0,0,0,0,0,0,0,0,0,0,0,0,0,0,0,0,0,0,0,0,0,0,0,0,0,0
"COMPASS-1629","08/01/2017 18:55:26",3,"Cross-realm Kerberos Support ""From CS-26551. After a bit of initial investigation, imagine this breaking out into 3 tasks:    - COMPASS-1629: Spike: Research additional options needed to support cross-realm kerberos via the connect dialog  - Add additional Kerberos options to connect dialog  - Kerberos Cross-Realm testing backend setup    {quote}  Compass RC1 - Internal Server Error With (Cross Realm) Kerberos @ Connect Time    Debug Console Shows:      Note in the java driver we would have to do something along the following, would this be something that node driver can expose to compass?     {quote}""","  POST http://localhost:29017/api/v1/token 500 (Internal Server Error)Request.end @ client.js:1016Model.extend.create @ token.js:69(anonymous function) @ token.js:119Item.run @ browser.js:64drainQueue @ browser.js:34_super.bugsnag @ bugsnag.js:149(anonymous function) @ bugsnag.js:624  bugsnag.js:239 [Bugsnag] Invalid API key 'undefined'  bugsnag.js:239 [Bugsnag] Invalid API key 'undefined'            MongoCredential gssAPICred = MongoCredential                  .createGSSAPICredential(KERBEROS + """"@WINDOWSREALM.COM"""")                  .withMechanismProperty(""""REALM"""", """"LINUXREALM.COM"""")                  .withMechanismProperty(""""CANONICALIZE_HOST_NAME"""", true);  ",1,0,0,0,0,0,0,0,0,0,0,0,1,0,0,0,0,0,0,0,0,0,0,0,0,0,0,0,0,0,0,0,0,0,0,0,0,0,0,0,0,0,0,0,0,0,0,0,0,0,0
"COMPASS-1735","08/15/2017 04:09:04",5,"Map Cmd-R (Ctrl-R) to reloading data only, Cmd-Shift-R app reload ""This request has been made many times, e.g. this intercom conversation:   https://app.intercom.io/a/apps/p57suhg7/respond/inbox/conversation/11245082354    Based on email discussion with Sam, Dana, Fred (see below), let's make the following changes:    Cmd-R (Ctrl-R on Windows/Linux) should reload data only. No app refresh.     Behavior:    - always trigger a reload of the sidebar, and  - if the user is on the instance level databases view: refresh the list of databases  - if the user is on the instance level RTSS view, reset the view  - if the user is on the database level collections view: refresh the list of collections  - if the user is on one of the collection level tabs, additionally execute the following action:  -- Documents tab: reload the documents (like the dedicated Refresh button)  -- Schema tab: execute a new schema sampling with the same query  -- Explain tab: execute a new explain plan with the same query  -- Indexes tab: refresh indexes  -- Document validation: reload validation rules       Cmd-Shift-R (Ctrl-Shift-R on Windows/Linux) should reload the app (behavior that is Cmd-R today).  ""","",1,0,0,0,0,0,0,0,0,0,0,0,0,0,0,0,0,0,1,0,0,0,0,0,0,0,0,0,0,0,0,0,0,0,0,0,0,0,0,0,0,0,0,0,0,0,0,0,0,0,0
