"issuekey","created","title","description","storypoint"
"DAEMON-151","11/16/2017 12:03:58","Spawning the ios plugin through appc cli errors with cannot find module plist","h5.Description      ioslib has a missing dependency which causes an error when distributed in the cli due to the legacy bundling style used.    h5.Steps to reproduce    # {{appc use 7.0.0-master.23}}  # {{appc appcd start && appc exec /ios/latest/info}}    h5.Actual    Error cannot find plist    h5.Expected    No error, environment info returned",1
"DAEMON-153","11/16/2017 15:01:41","appcd: appcd start --debug should respect a --no-colors flag","h5.Description    Writing up a guide on how to provide information when reporting issues. Noticed that appcd start --debug --no-colors still logs in colour, would be nice if the debug logs provided by people didnt have the escape codes.    h5.Steps to repro    # appcd start --debug --no-colors    h5.Actual    Colours    h5.Expect    No colours",2
"DAEMON-154","11/16/2017 18:06:14","JSON Strings should be wrapped in double quotes","json strings are coming in single quotes but it should be in double quotes.    *To reproduce*  # Run {{appc appcd exec /system-info/1.x/info --json --no-banner}}  # Valdiate the output here https://jsonformatter.curiousconcept.com     Studio json parser validation is failing due to this.  ",2
"DAEMON-155","11/16/2017 18:28:01","ios info is null due to ""Failed to load plugin: Cannot find module 'plist' ""","I can't see ios info in the  {{appc appcd exec /system-info/1.x/info --json}}    *To reproduce:*  # Run appc use 7.0.0-master.22  # appc appcd exec /system-info/1.x/info --json  # Verify ios info - it's null    Please find the attached appcd dump file. ",1
"DAEMON-156","11/16/2017 19:01:16","appcd: Auto import config settings from Titanium CLI","It would great to be able to import the Titanium CLI config into the appcd user's config in {{~/.appcelerator/appcd/config.json}}.    Mappings would be as such:    * {{android.adb.port}} (Number) -> {{android.adb.port}} (Number)  * {{android.executables.aapt}} (String) -> {{android.executables.aapt}} (String)  * {{android.ndkPath}} (String) -> {{android.ndk.searchPaths}} (Array<String>)  * {{android.sdkPath}} (String) -> {{android.sdk.searchPaths}} (Array<String>)    The list goes on and on... https://wiki.appcelerator.org/display/guides2/Titanium+CLI+Options.    Here's the unmaintained list: https://wiki.appcelerator.org/display/CLI/CLI+Config+Settings.",3
"DAEMON-157","11/16/2017 21:46:18","appcd: Suppress banner when run through appc","h5.Description    It was raised that the double banner when running {{appc appcd}} shouldn't happen, we should suppress this, I think we can use the APPC_ENV environment variable to do so, alternatively we could have the CLI push a {{--no-banner}} flag but I prefer the former",1
"DAEMON-158","11/16/2017 22:29:19","Querying iOS devices results with ""Cannot find module 'plist' ""","*Description*  Running the command ""appc appcd exec /ios/latest/info/devices""  errors out with a message cannot find plist    *Steps to reproduce*  1. Install CLI 7.0.0-master.23  2. Start the daemon with ""appc appcd start""  3. Connect an iOS devices and check that it's recognized eg. appc ti info  4. Run the command ""appc appcd exec /ios/latest/info/devices""    *Actual result*  This result is seen:  Failed to load plugin: Cannot find module 'plist'    *Expected Result*  An output showing some details about the iOS device that is connected. No errors should be seen.",1
"DAEMON-159","11/16/2017 22:49:52","appcd-plugin: Can't [force] stop a plugin that's starting","It's possible for a plugin to be started, but activate() to be hung waiting for an unresolved promise. In this case, you can't stop the plugin until it starts.    We should allow plugins to be stopped if the plugin is started, but not activated.    We should allow plugins to be force stopped regardless if it's started, starting, or stopping.",3
"DAEMON-160","11/17/2017 01:10:40","ioslib: Versioning of package on npm is causing issues","h5.Description    *I know this isn't really a proper ticket but I needed somewhere to dump this*    Currently the ioslib version being pulled in is ioslib@2.0.0-beta.3 based off the version range of ^2.0.0-8. This (surprisingly to me) is correct in semver land and 2.0.0-beta.3 is considered to be greater than 2.0.0.-10 https://runkit.com/ewanharris/5a0e34d8e7d5da001228faf7    So currently we're borked and need a way out, here's the possible solutions, in no order.    # Bump ioslib to become ioslib@2.0.0-beta.4, replacing 2.0.0.-10  # Change the appcd-plugin-ios dependency to next, stay like this  # Change the appcd-plugin-ios dependency to next, ask npm nicely to remove ioslib@2.0.0-beta.3 (I dont see why they wouldnt), then eventually move back to ^2.0.0-10 version ranges.  # Release ioslib@2.0.1-0, move appcd-plugin-ios to ^2.0.1-0    I vote for 3 or 4 with an added sprinkle of promising to never do -beta.X on npm packages again :)",5
"DAEMON-161","11/17/2017 10:23:59","Windows: Visual Studio path is incorrect in the system-info","Visual studio path is incorrect in the windows system-info path    *Actual:*  C: /ProgramFiles(x86)/MicrosoftVisualStudio14.0/    *Expected:*  C:\Program Files (x86)\Microsoft Visual Studio 14.0      Same goes for the Windows Phone SDK path    *Actual:*  C: \ProgramFiles(x86)\MicrosoftSDKs\WindowsPhone\v8.1\    *Expected:*  C:\Program Files (x86)\Microsoft SDKs\Windows Phone\v8.1  ",1
"DAEMON-162","11/17/2017 10:49:36","Windows system-info: 10.0 SDK emulators are not shown","Windows Phone SDK 10.0 emulators are missing in the windows system-info.  ",3
"DAEMON-163","11/17/2017 10:54:32","Windows OS:  /system-info/1.x/info command is not responding","/system-info/1.x/info command hangs on the windows machine. It's an intermittant issue.    Looks like it's getting into recursive loop on ""Detecting devices info""",2
"DAEMON-166","11/17/2017 18:49:22","appcd-plugin-android: Plugin activation hangs if no Android SDKs are found","If the system does not have any Android SDKs, the detect engine will return an empty array, however since it is initialized to an empty array, there's no change and thus no notifications and the detection hangs.    The fix requires a check if the results are empty, then resolve the SDK detection. However in doing this, it exposed a timing bug with NDK detection.",8
"DAEMON-167","11/18/2017 03:39:34","Android and Genymotion emulators are empty","Android and Genymotion emulators are shown empty on the latest daemon 1.0.0-12    Please find the attached files",13
"DAEMON-168","11/18/2017 03:59:49","appId is missing in the provisioning profiles","appId is missing in the provisioning profiles",1
"DAEMON-169","11/18/2017 17:25:48","Issues with Xcode info returned","Couple of issues found in the Xcode information returned when querying ""appc appcd exec /ios/latest/info""    1. Any Xcode that is not present in the /Applications is not returned    2. The latest xcode in the system is returned as default even after switching to another xcode for default.   Check the attached ""appcd.txt "" for output of running the ""appc appcd exec /ios/latest/info"" and the ""appcCLI.txt"" for output running ""appc ti info -t ios""    The Xcode in downloads folder was made default but daemon output returns the latest code in /Applications as the default and does not list the Xcode in /downalods ",3
"DAEMON-170","11/20/2017 05:41:16","Move plugins out of appcd-daemon repo into separate repos","Once Appc Daemon 1.0.0 ships, we should move the plugins out of the {{appcd-daemon}} repo and into separate repos. This will allow each plugin to be versioned independently of each other and the Appc Daemon core.    Also move {{appcd-default-plugins}} into a separate repo so that we can add/remove plugins without having to publish a new appcd.",13
"DAEMON-171","11/20/2017 05:55:34","appcd: Stop any running daemon instances post npm install","After installing the Appc Daemon, the post install script should use the just installed Appc Daemon code to stop so that the new code will be run.",2
"DAEMON-173","11/20/2017 16:51:08","windowslib: EBUSY error on wptool executable","h5.Description    When running appcd exec /system-info/1.x/info/ it seemed to be taking longer than usual to return, checking the logs I saw the below, I think it's possible that two detect processes are attempting to build wptool at the same time. We apparently deal with this inside windowslib but it seems to be flaky, it might be wise to stagger the detects to allow one to build before the other runs    I've had trouble reproducing this in an appc cli build fwiw    {code}  2017-11-20T16:24:57.446Z appcd:plugin:host:21052 error Caught exception: Error: EBUSY: resource busy or locked, open 'C:\Users\ewan\Documents\git\appc-daemon\node_modules\windowslib\bin\wptool.exe'  2017-11-20T16:24:57.446Z appcd:plugin:host:21052 error     at Object.fs.openSync (fs.js:646:18)  2017-11-20T16:24:57.446Z appcd:plugin:host:21052 error     at Object.fs.writeFileSync (fs.js:1291:33)  2017-11-20T16:24:57.446Z appcd:plugin:host:21052 error     at Object.callback (C:\Users\ewan\Documents\git\appc-daemon\node_modules\windowslib\lib\wptool.js:596:7)  2017-11-20T16:24:57.446Z appcd:plugin:host:21052 error     at C:\Users\ewan\Documents\git\appc-daemon\node_modules\windowslib\lib\visualstudio.js:423:9  2017-11-20T16:24:57.446Z appcd:plugin:host:21052 error     at Array.forEach (<anonymous>)  2017-11-20T16:24:57.446Z appcd:plugin:host:21052 error     at ChildProcess.<anonymous> (C:\Users\ewan\Documents\git\appc-daemon\node_modules\windowslib\lib\visualstudio.js:415:11)  2017-11-20T16:24:57.446Z appcd:plugin:host:21052 error     at emitTwo (events.js:126:13)  2017-11-20T16:24:57.446Z appcd:plugin:host:21052 error     at ChildProcess.emit (events.js:214:7)  2017-11-20T16:24:57.446Z appcd:plugin:host:21052 error     at maybeClose (internal/child_process.js:925:16)  2017-11-20T16:24:57.446Z appcd:plugin:host:21052 error     at Process.ChildProcess._handle.onexit (internal/child_process.js:209:5)  {code}    h5.Steps to reproduce    # Remove wptool.exe from windowslib/bin folder  # Start the daemon {{[appc] appcd start}}  # Query system info {{[appc] appcd exec /system-info/1.x/info/}}    h5.Actual    Plugin hangs, windows error above shown in logs    h5.Expected    No hang",8
"DAEMON-176","11/21/2017 11:26:20","Plugins: Pickup the imported values from the titanium config","h5.Description    DAEMON-156 implemented importing the ti config, so lets implement it into the plugins. We should also watch the config for these values so we rescan if they get set",2
"DAEMON-178","11/22/2017 06:24:41","Sync ""appc ti config"" with the ""appc appcd config"" ","How and when do we sync {{appc ti config}} settings to {{appc appcd config}} - so that when studio is working with Appc Daemon it can only look for {{appc appcd config}}    Since everybody is trained to work with {{appc ti config}} and they might configure android.sdkPath, sdk.selected,etc., and expect they will be picked up directly in the studio    Any thoughts around it?  ",1
"DAEMON-179","11/22/2017 10:37:58","Android NDK is blank in system-info ","The android info fetched using ""appc appcd exec /android/latest/info"" returns Android NDK as blank.    Attached is the android output returned by appcd and appc cli",8
"DAEMON-181","11/22/2017 20:02:54","appcd-config: Figure out how to set metadata for non-appcd config settings","We currently do not have plugins define metadata for plugin specific config options. Plugins do not have access to the main config object, thus they cannot directly add metadata.    One solution would be for the plugin system to read a plugin specific metadata config and merge it into the main config.",8
"DAEMON-182","11/22/2017 20:04:58","androidlib: Addons with a manifest.ini not detected","At some point, Android SDK add-ons moved away from {{source.properties}} files and to a {{manifest.ini}} file. We need to support both.",5
"DAEMON-184","11/23/2017 13:30:01","windowslib: Unable to build wptool project on a machine where the username contains spaces","h5.Description    *This isn't a new bug, just exposed by how we decided to expose appcd*    One of my machines has a space in the name, this causes an error when building the wptool executable and we're not in the temp dir, we need to escape the project path correctly",5
