"issuekey","created","title","description","storypoint"
"DAEMON-193","11/28/2017 04:45:04","Failed to start the Appc Daemon","""Failed to start the Appc Daemon"" message shown when I start a daemon.     {code:java}  ITEM-AX40113:titanium_studio kkolipaka$ appc appcd start  Appcelerator Command-Line Interface, version 7.0.0-master.48  Copyright (c) 2014-2017, Appcelerator, Inc.  All Rights Reserved.      Failed to start the Appc Daemon  {code}    Looks like it's showing a wrong message when the daemon is already running.    {code:java}  ITEM-AX40113:titanium_studio kkolipaka$ appc appcd start --debug  Appcelerator Command-Line Interface, version 7.0.0-master.48  Copyright (c) 2014-2017, Appcelerator, Inc.  All Rights Reserved.      Starting inspector on 127.0.0.1:9229 failed: address already in use  Failed to start the Appc Daemon  {code}  ",8
"DAEMON-195","11/28/2017 05:26:14",""" appc appcd exec start"" not working anymore","{{appc appcd exec start}} not working anymore.      {code:java}  $ appc appcd exec start  Appcelerator Command-Line Interface, version 7.0.0-master.48  Copyright (c) 2014-2017, Appcelerator, Inc.  All Rights Reserved.    Not Found    {code}  ",1
"DAEMON-196","11/28/2017 10:44:42","appcd-core: Ensure the pid file always exists","When the daemon is running, it creates a pid file in the appcd home dir. This is critical as it is used to determine if the daemon is running. If this file is deleted while the daemon is running, this can be problematic as the zombie daemon process will need to manually terminated by the user.",3
"DAEMON-198","11/28/2017 20:23:59","Plugin config changes are not applied automatically","The Android, Genymotion, iOS, and Windows plugins have config options that are loaded once when the plugins are started. If any plugin specific config options are changed, then do not take effect until the plugin(s) or the daemon is restarted.    h4. Default config    * plugins.autoReload  ** appcd-plugin/src/external-plugin.js  * plugins.defaultInactivityTimeout  ** appcd-plugin/src/plugin.js  * server.agentPollInterval  ** appcd-core/src/status-monitor.js  ** appcd-plugin/src/external-plugin.js    h4. appcd-plugin-android    * android.ndk.searchPaths  ** appcd-plugin-android/src/android-info-service.js  * android.sdk.searchPaths  ** appcd-plugin-android/src/android-info-service.js",5
"DAEMON-200","12/04/2017 09:33:32","Android device not detected when plugged in after daemon start upon system restart","Steps to Reproduce:  1. Restart the system and make sure to plug out connected android device  2. Start Daemon  3. Run the command ""/android/1.x/info"". The devices section is blank as no device connected yet  4. Connect the device.  5. Again run the command ""/android/1.x/info"".    Actual Result:  The device section still shows blank and does not show the connected device.  The device is shown in ""appc ti info"".  Note: Repeating step 5 continues to give device as blank untill daemon is restarted.    Find attached the daemon dump.",8
"DAEMON-204","12/06/2017 15:51:17","appcd-winreg: Add support for specifying registry hive architechture","h5.Description    From my research into windowslib v2 we're going to need to query the 32 bit registry hive architecture, this can be achieved by passing an opt.arch value to win-reg. If no value is specified we should default to null. This will also need to be added to appcd-detect",1
"DAEMON-209","12/11/2017 08:39:21","Studio: iOS SDK home not found and NullPointerException","I updated to Appcelerator Studio 5.0.0.201712081732 (official Release) and now the iOS SDK home is not found anymore. Android works.    Can I do something to fix it?    --    There's a bug in ioslib when it tries to build the list of teams. If one of the provisioning profiles does not have any teams, then the {{teamIds}} will be {{null}}. The code that builds the unique list of teams expects teams to be an array.",8
"DAEMON-205","12/11/2017 15:22:57","ioslib: Failing to parse certs if any cert has invalid unicode sequences","It's possible for a cert to have a name that cannot be decoded to an unsupported character sequence. We need to wrap each cert parsing in a try/catch so that we just skip the cert and move on.",3
"DAEMON-206","12/11/2017 15:42:34","Appcelerator Studio not detecting iOS after upgrading","After upgrading Xcode, Appcelerator Studio and node, I can't run any application from Appcelerator Studio.    The Run/Debug buttons have disappeared, whenever I click on anything concerning iOS, I get the error:    !MESSAGE An internal error occurred during: ""Loading Provisioning Profiles..."".  !STACK 0  java.lang.NullPointerException    Attached some of the weird things happening + the logs.    I already tried uninstalling Appcelerator Studio, it didn't change anything (besides losing all of my configurations)    ",1
"DAEMON-207","12/11/2017 18:48:53","""appc appcd restart"" does not restart the daemon but keeps on adding appcd-plugin-host processes which keep running & consume memory","h5.Steps to reproduce:  1. Do a {{appc appcd restart}} in the command prompt.    h5.Actual results:  1. The daemon does not restart (Not sure if it does restart internally, but gives wrong message that it didn't in the terminal).  {code}  ITEM-AX44549:QEUtility-Node lchoudhary$   ITEM-AX44549:QEUtility-Node lchoudhary$ appc appcd restart    Appc Daemon already started  ITEM-AX44549:QEUtility-Node lchoudhary$ appc appcd restart    Appc Daemon already started  ITEM-AX44549:QEUtility-Node lchoudhary$ appc appcd restart    Appc Daemon already started  ITEM-AX44549:QEUtility-Node lchoudhary$ appc appcd restart    Appc Daemon already started  ITEM-AX44549:QEUtility-Node lchoudhary$ appc appcd restart    Appc Daemon already started  ITEM-AX44549:QEUtility-Node lchoudhary$ appc appcd restart    Appc Daemon already started  ITEM-AX44549:QEUtility-Node lchoudhary$ appc appcd restart    Appc Daemon already started  ITEM-AX44549:QEUtility-Node lchoudhary$ appc appcd restart    Appc Daemon already started  ITEM-AX44549:QEUtility-Node lchoudhary$ appc appcd restart    Appc Daemon already started  ITEM-AX44549:QEUtility-Node lchoudhary$ appc appcd restart    Appc Daemon already started  {code}    2. It also keeps on adding {{appcd-plugin-host}} processes after each restart command run. These processes stay running & consume memory. (Attached a screenshot for reference).    h5. Expected results:  1. Daemon should restart successfully every time command is run & should not keep on adding new appcd-plugin-host processes or kill/stop the old ones.  ",13
"DAEMON-211","12/14/2017 00:20:40","issues reflecting available iOS mobileProvision profiles","Have downloaded new provisioning profiles as I have a new device to test/run the app in AdHoc mode.    I have deleted the existing provisioning files and updated with the new ones (files in command line are the new ones). I have restarted Studio, XCode and the computer for changes to take effect but no success.    I am unable to package apps using the new profiles as the certificates are still the old ones. 'Refresh' button doesn't seem to reflect the changes made to certificates and to provisioning Profiles.",3
"DAEMON-210","12/14/2017 20:11:19","system-info: npm detection fails if unable to get npm prefix","The system-info plugin is responsible for detecting npm. It does this by first locating the npm executable in the system PATH, then tries to get the ""prefix"" by running {{npm prefix -g}}. However, if this should fail, then the prefix will be {{undefined}} and an exception is thrown when trying to expand the path.",5
"DAEMON-214","01/08/2018 16:24:47","Create Appc Daemon plugin template","We need a template for creating new appcd plugins.",13
"DAEMON-216","01/09/2018 20:15:34","Plugins not ordered on status output","The plugins in the output from {{appcd status}} are not ordered.",3
"DAEMON-217","01/09/2018 22:51:38","appcd-plugin-titanium-sdk: Titanium info service","Create the {{appcd-plugin-titanium-sdk}} plugin and the ""info"" service. The ""info"" service is to detect installed Titanium SDKs and modules.",13
"DAEMON-218","01/11/2018 20:51:21","appcd-detect: Subdirectories are not watched for changes that would make them valid","When detecting things in a directory, if a subdirectory is created, but the criteria in that subdirectory does not exist yet, the subdirectory is never rescanned. This only applies when {{opts.watch=true}}.",5
"DAEMON-221","01/16/2018 16:40:44","gulp upgrade: Run 'yarn' in top-level after updates and 'yarn upgrade' for each package","The {{gulp upgrade}} task does a good job of updating all of the npm dependencies in each package's {{package.json}}, but the top-level doesn't actually install the new deps. I think we simply need to remove the call to {{lerna bootstrap}} and call {{yarn}}.    Also, we never upgrade the dependencies of dependencies. We need to write temporary {{package.json}} files with no {{appcd-*}} deps, run {{yarn upgrade}}, then restore the original {{package.json}}. This will update the {{yarn.lock}} files.",5
"DAEMON-223","01/21/2018 20:20:22","Plugin: Noisy warnings in log due to invalid appcd plugins","The plugin system will check several directories to see if they are a appcd plugin, however if there are several non-appcd plugin modules, the log will be filled with a bunch of bogus warnings.    We need to filter out these warnings so that we only error if we find an appcd plugin with invalid appcd settings.",5
"DAEMON-224","01/23/2018 17:24:47","Subscriptions not terminated if connection is reset","If a client goes away, the WebSocketServer can emit an error {{ECONNRESET}} instead of emitting an ""end"" event.    We need to add better logging and also listen for errors so that we can end the internal subscription stream.",5
"DAEMON-230","02/02/2018 16:42:06","Stream stringified JSON data over IPC and response instead of JSON.stringify()","When a plugin sends a JS object response over IPC or a service writes a JS object response over the WebSocket or HTTP response, the JS object is serialized using {{JSON.stringify()}}. However, {{JSON.stringify()}} eats up a ton of memory when the JS object is large. It would be much more efficient to stringify while writing to the stream.    There are several npm packages that will stringify a stream, but they are geared towards each write being a small object which they just call {{JSON.stringify()}} on it.    What we need is transforming stream that does stringifies the JS object on the fly. Stringify is not a complex algorithm, but would need to figure out how to handle Node specific objects like {{Buffer}}.",3
"DAEMON-232","02/08/2018 17:49:54","FSWatcher: Events relating to permission changes to a folder are dropped on Windows","h5.Description    In DAEMON-222 changed were made to prevent unnecessary change events (a child item changing for example) on a folder bubbling up, which had the side-effect of causing any change events to not fire for a folder on Windows. The current solutions for tracking information through fs.Stats is lightweight on Windows a potential native module (https://github.com/xxoo/node-fswin) was found but the heaviness of using this module wasn't wanted. This is more than likely going to need to be sovled in the future    It's probable that issues relating to permissions will be prevalent on unixy systems too    h5.Steps to repro    TODO",13
"DAEMON-237","02/15/2018 15:04:55","Create Appc Daemon 1.1.0 release notes","Need to go through the appc-daemon repo and all plugins and write up release notes for v1.1.0.",8
"DAEMON-238","02/16/2018 04:22:57","appcd-util: Add ability to cancel a debounce","{{debounce()}} uses a {{setTimeout()}} that has no way to be cancelled. This becomes a problem if you are debouncing events for something that you have shutdown.",3
"DAEMON-239","02/16/2018 04:27:01","appcd-plugin: Scheme needs to cancel debounced scheme change events on shutdown","When the PluginManager shuts down, it unregisters all plugin paths and the scheme associated with the plugin path. If it's shut down while a scheme's debounced change event is pending, things go haywire. The scheme {{destory()}} method needs to call the {{cancel()}} method introduced by DAEMON-238.",5
"DAEMON-241","03/08/2018 16:36:15","Telemetry: Events are being sent using the incorrect guid","h5.Description    Currently the daemon defaults to preproduction for the telemetry. After some discussions it was decided that we need to not have a concept of preproduction and instead do the following    * Remove preprod  * Remove prod, put into default.js  * Add deploytype to the analytics payloads  * In the gulp scripts, we should set the telemetry environment on start  * Document the variable  * Validate that the analytics being sent are shown on dashboard  ",5
"DAEMON-242","03/09/2018 04:34:12","appcd: Global options not displayed on command help","Global options should be displayed on the help screen for individual commands, but it's not.    {code}  $ appcd --help  Usage: appcd <command> [options]    Commands:    config   get and set config options    dump     dumps the config, status, health, and debug logs to a file    exec     connects to the Appc Daemon and executes the request    logcat   streams Appc Daemon debug log output    restart  stops the Appc Daemon if running, then starts it    start    starts the Appc Daemon if it's not already running    status   displays the Appc Daemon status    stop     stops the Appc Daemon if running    Global options:    --config=<json>       serialized JSON string to mix into the appcd config    --config-file=<file>  path to a appcd JS config file    --no-colors           disables colors    -h, --help            displays the help screen    -v, --version         outputs the appcd version  {code}    Global options are present above.    {code}  $ appcd start --help  Usage: appcd start [options]    starts the Appc Daemon if it's not already running    start options:    --debug  don't run as a background daemon  {code}    Global options are not displayed enough.  ",5
"DAEMON-244","03/14/2018 16:05:04","appcd-nodejs: Add mechanism for removing old Node.js executables","We would like to upgrade the Node.js version of the Appc Daemon, but everytime we do, it will download a new Node.js executable. The problem is we do not want to end up with dozens of Node.js executables.    We need a way of timestamp when a specific version of Node.js was last run. Then {{appcd-nodejs}} needs a service that uses a {{setTimeout()}} that periodically archives/deletes executables that haven't been used for some period of time.",8
"DAEMON-245","03/15/2018 06:23:33","Upgrade to latest babel packages","Update the daemon's babel dependencies to the latest and greatest.",8
"DAEMON-246","03/22/2018 15:54:21","appcd-plugin-titanium-sdk: Split info service into sdk and module services","We need to split the info service into distinct sdk and module services so that it becomes more logical when we add more functionality for sdks and modules.",5
"DAEMON-247","03/23/2018 05:50:02","appcd-plugin-titanium-sdk: Add install, uninstall, and search ","Now that the Titanium SDK plugin has a ""sdk"" service that lists all installed Titanium SDKs, we need the ability:    * To search for available SDKs to download (by name or branch)  * Download and install an SDK from an Appc server  * Download and install an SDK from an arbitrary URL  * Install an SDK from a local zip file  * Uninstall a SDK",13
"DAEMON-248","03/30/2018 04:12:04","Allow arbitrary metadata to be added to error objects","As the daemon routes errors from a plugin to the core or from the core over a WebSocket, errors are treated special so that can recreate the error as a real Error object whenever coming for another context. The problem is error properties are whitelisted and some are computed (getters).    All error handling needs to be cleaned up so that we can pass along arbitrary values added to the original error object.    When {{appcd exec}} is returned an error, the error should be stringified to reveal all properties including the hidden error object properties.",8
"DAEMON-249","04/09/2018 12:18:58","appcd-plugin-android: Genymotion emulators not reloaded on change","h5.Description    When making changes to genymotion emulators they are not reloaded under the {{/android/latest/info/emulators}} endpoint, however they are reloaded under the {{/genymotion/latest/info/emulators}} endpoint. It looks like we just need to include the vbox config path in the watch paths    h5.Steps to reproduce    * Start the daemon {{appcd start}}  * Call {{appcd exec /android/latest/emulators}}  * Either add or remove a genymotion emulator  * Call {{appcd exec /android/latest/emulators}}  * Call {{appcd exec /genymotion/latest/emulators}}      h5.Actual    Genymotion emulator not changed in the android endpoint, it is in the genymotion endpoint    h5.Expected    Should be changed in both",3
"DAEMON-250","04/09/2018 15:02:30","@appcd/plugin-ios: New iOS simulator runtimes are not picked up after install","h5.Description    *This is probably an improvement as I can't find any reference to us currently attempting to do this*    If I install a new iOS simulator runtime in xcode, then the daemon will not pick it up. Looking through the code, I think we need to set up a watcher on [xcode.globalSimProfilesPath|https://github.com/appcelerator/ioslib/blob/6189855ebc055f85957b93bf4bbe595189607396/src/xcode.js#L29] in ioslib and rescan xcodes and simulators on change.      h5.Steps to reproduce  * Start the daemon {{appcd start}}  * Call the ios info endpoint for xcode info {{appcd exec /ios/latest/info/xcode}}, make note of the simRuntimes property  * Install a new sim runtime through Xcode (Xcode->Preferences->Components)  * When finished call the ios info endpoint again, noting the simRuntimes property for the xcode you installed the runtime in    h5.Actual    No new runtime is detected    h5.Expected    New runtime should be detected",3
"DAEMON-251","04/11/2018 21:51:49","appcd-plugin: Plugin info not updated when package.json is changed","Once the plugin system detects and registers a plugin, it doesn't reload the plugin information when the package.json is changed.    If the package.json is modified, the plugin should be stopped. Furthermore, if the package.json is not valid JSON, then it should also be unregistered.",5
"DAEMON-252","04/12/2018 21:17:21","Android: Daemon does not detect addition/deletion of genymotion emulator's immediately","Does not appear to be a regression. Seen in 1.0.1 as well.    h5.Steps to reproduce:  1. Add a 2-3 genymotion emulator in the genymotion app.  2. Run {{appc appcd exec /android/latest/info/emulators}}.  3. Repeat the steps after deleting 2-3 genymotion emulators.    h5.Actual result:  1. Appc daemon does not pick up the changes to genymotion immediately for both addition & deletion scenarios but, does after an {{appc appcd restart}}.    h5.Expected results:  1. Appc daemon should pickup the changes immediately.",8
"DAEMON-253","04/13/2018 23:04:37","Paths of interest should only be watched once","The quick and dirty {{watch()}} method used in the Android and iOS appcd plugin info service will record all active fs watch subscription ids, re-watch all paths of interest, then unwatch the original subscription ids. This works, but can lead to fs events being lost.    This issue was discovered while fixing DAEMON-252.",5
"DAEMON-255","04/25/2018 15:42:54","Appcelerator Studio not detecting android emulator and emulator doesn't come up on windows 7","Hello,    We have an Enterprise customer who is facing an issue with Appcelerator Studio. Appcelerator Studio not detecting android emulator and emulator doesn't come up on windows 7. We have attached the screenshot, Studio Diagnostic log and *appc ti setup check* log file.     If any others information needed please let us know.    Thanks",5
"DAEMON-256","05/15/2018 21:50:58","Update appcd to latest cli-kit and export CLI definintion","cli-kit now allows for extensions and appcd needs to export its CLI definition to be consumable by other cli-kit enabled CLI's.",13
"DAEMON-258","05/23/2018 16:48:35","appcd-gulp: Replace del.sync() with fs.removeSync()","Since we already depend on {{fs-extra}}, just use it's {{fs.removeSync()}} function instead of pulling in {{del}}.",3
"DAEMON-260","06/26/2018 04:47:14","Android configuration issues with the Studio 5.1.0","Hi all.  I am having issues with Studio on my Mac. It seems to randomly not know that I have Android SDKs installed.  It worked last week.  Just this morning, I start up studio and on the dashboard I see that Android is ready to go.  Then an few seconds later it changes to grayed out and the button says download.  I click download and run the install - when I do it recognizes that I already have some versions of the SDK installed.  But once through the install process, the problem still exists.  I have been doing this all morning.  An interesting point is that one of the times I did this process, it worked and I saw the emulators that I have always had available in Studio.   Also note that the preferences pane in Studio sometimes shows that it has found the SDKs and the emulators dropdown is populated, but most of the time it looks like the attached screenshot.  Any help would be greatly appreciated as I am unable to do Android mobile demonstrations and I have several in the near future.  Thanks in advance.",5
"DAEMON-263","09/28/2018 16:02:34","appcd-core: Add AMPLIFY CLI version to telemetry","Add AMPLIFY_CLI env var to the telemetry payload.",2
"DAEMON-265","10/22/2018 16:18:29","appcd-plugin: Expose services in plugin info","Wouldn't it be cool if plugin info included a list of service endpoints!?",3
"DAEMON-266","10/25/2018 14:22:51","appcd exec doesn't properly handle streamed responses","There is an issue where non-subscription based responses are not being terminated when finished. The problem stems from the {{WebSocketSession}} not properly sending a {{fin: true}} on the last message and the client not handling the last message in the request.",8
"DAEMON-267","10/25/2018 17:05:11","Investigate possibility of bi-directional websocket requests",".",1
"DAEMON-270","01/24/2019 19:45:04","Appcd Deamon not working ","*Steps To Reproduce:*  1.Run  appcd command in terminal  {code}  appc appcd restart  {code}  *Expected:*  Daemon should be restarted   *Actual:*  The daemon refuses to start and throws error  An uncaught exception was thrown!  Cannot destructure property `filesize` of 'undefined' or 'null'.  Cannot destructure property `filesize` of 'undefined' or 'null'.  *Note1:*  For me when I changed the cli to 7.0.9 ,it worked fine.  *Note 2:*  For Josh Quick ,this happens with CLI v7.0.9 also and he tried with node v8.9.3 and v10.15.0   It also causes Appc Studio to beach ball forever",5
"DAEMON-271","02/14/2019 21:13:20","Error streaming object responses to HTTP clients","When a request is made to a service from an HTTP client, such as {{curl}}, that streams an object response, the dispatcher context's response stream is eventually piped into Koa's HTTP server's response stream which expects streamed chunks to be either strings or buffers. When an object is streamed, an error is thrown.    The solution is to stringify the object before it gets piped to the server response.",5
"DAEMON-272","02/14/2019 23:28:36","appcd-subprocess: Remove HTTP source check","The {{SubprocessManager}} has a false security measure where only requests from internal routes and plugins and requests from WebSockets can spawn commands. Requests from HTTP are forbidden.    Since WebSockets requests are essentially HTTP requests, there's no point blocking HTTP requests. The daemon's web server listens on localhost only, so there's no way for an outside actor to spawn a command.    To make things worse, the check to see if the source is indeed ""http"" is broken. It checks if {{ctx.request.source}} is ""http"" when it should be checking {{ctx.source}}.    This restriction is pointless and does not work. It should just be removed.",5
"DAEMON-273","04/02/2019 08:00:04","appcd-plugin: Tunnel messages missing dispatcher context props","Plugins run in a child process and communicate with a parent process using an IPC-based tunnel. However the tunnel does not translate over the {{headers}} and {{source}} from a {{DispatcherContext}} instance.    Instead of passing the {{DispatcherContext}}'s {{request}} property, the tunnel needs to step up one level and pass the {{headers}}, {{path}}, {{request}} (formerly ""data""), and {{source}}.",8
"DAEMON-274","04/03/2019 21:29:42","appcd-config: Added support for config layers to be used by plugins","Plugin configs are loaded and mixed with the global config, but it's merged at a global level and once merged, remains merged until the daemon is stopped. It also doesn't namespace the plugin configs.    To solve this, {{appcd-config}} needs the ability to define config layers. There is a default root layer, but then each registered config file from plugin is a new layer. These plugin config layers are namespaced so that they don't conflict.    Note that this does not affect the user-defined config which overlays everything.",8
"DAEMON-275","04/30/2019 06:15:11","appcd-gulp: Add Node.js 12 babel conf","Node.js 12 ships with V8 that supports new JavaScript features that do not require transpilation. Among the new features are class fields.    Node 12 also has support for modules, though this may be a larger scope than simply removing ES6 module transpilation.",5
"DAEMON-276","05/26/2019 13:28:52","Deprecate appcd-winreg","Now that {{winreglib}} is done, there is no need for {{appcd-winreg}}, so mark the npm package as deprecated and update the following packages to use {{winreglib}} instead:  * {{appcd-detect}}  * {{appcd-response}}  * {{appcd-machine-id}}",5
