"issuekey","created","storypoint","context","codesnippet","t_New.Feature","t_Bug","t_Improvement","t_Task","c_Valdator.Server","c_Go.SDK","c_Packaging","c_XO.Family","c_Documentation","c_Validator.Global.State","c_Settings.Family","c_sawtooth.core","c_Validator.Txn.Execution","c_Continuous.Integration","c_REST.API","c_Javascript.SDK","c_Python.SDK","c_PoET","c_Supply_Chain","c_Validator.Journal","c_OMI.Summer.Lab","c_Hyperledger","c_sawtooth.CLI","c_Validator.Networking","c_Burrow.EVM","c_Java.SDK","c_Private.Transaction","c_Design","c_C...SDK","c_Poet2"
"STL-498","06/19/2017 21:05:22",5,"Create State Delta Subscriber ""Create a delta state subscriber that will consume state values for the SupplyChain transaction family and store them in a database.     This task involves creating the subscriber, processing the events to insert values.  This client should handle disconnects and reconnects of the validator, delta catch-up, as well as fork resolution.""","",0,0,1,0,0,0,0,0,0,0,0,0,0,0,0,0,0,0,1,0,0,0,0,0,0,0,0,0,0,0
"STL-499","06/19/2017 23:11:44",3,"Update ParallelScheduler to handle explicit dependencies ""If a txn has explicit dependencies, it should first look to see if that txn is before it* in the scheduler, and then only if it is use that explicitly dependent txn as a gate on it being next transaction.    Because 'intkey workload' uses dependencies, the parallel scheduler won't work with intkey workload until this is done.    * We are relying on the completer to never allow the dependency to be after that batch with the transaction that lists the dependency.""","",0,0,1,0,0,0,0,0,0,0,0,0,1,0,0,0,0,0,0,0,0,0,0,0,0,0,0,0,0,0
"STL-506","06/22/2017 15:07:21",3,"Debug scheduler never becoming complete ""On AWS often, and in test_poet_smoke.yaml sometimes, block validation within the validator fails to get a complete schedule; scheduler.complete(block=True) is called and never returns.""","",0,1,0,0,0,0,0,0,0,0,0,0,1,0,0,0,0,0,0,0,0,0,0,0,0,0,0,0,0,0
"STL-509","06/27/2017 00:05:19",1,"intkey and xo commands produce bad output without arguments ""{{docker exec -it sawtooth-client-default bash}}  {{root@bdd0cd71cfd1:/# xo}}  {{Error: invalid command: None}}  {{root@bdd0cd71cfd1:/# intkey}}  {{<_io.TextIOWrapper name='<stderr>' mode='w' encoding='ANSI_X3.4-1968'> Error: invalid command: None}}    {{It would be nice if intkey and xo would give usage messages if a required positional argument is missing.}}""","",0,1,0,0,0,0,0,0,0,0,0,0,0,0,0,0,0,0,0,0,0,0,1,0,0,0,0,0,0,0
"STL-510","06/27/2017 15:55:46",2,"Modify App Dev Guide ubuntu section to not require root user ""The App Dev guide should not assume all commands need to be run w/root.  Instead, it should provide sudo when appropriate and run services as sawtooth and user commands as the regular user.  ""","",1,0,0,0,0,0,0,0,0,0,0,1,0,0,0,0,0,0,0,0,0,0,0,0,0,0,0,0,0,0
"STL-536","07/05/2017 22:33:52",2,"Rename cli commands ""Various commands for 0.8 were added with the assumption that we  would at some point rename them for consistency across the project.  Now seems an appropriate time to pick the final names and do the  renaming.    Commands will use a '-' separator instead of '_', since this is  more consistent with Linux commands in general.    The clients commands remain largely unchanged, with intkey_jvm being  renamed to jvmsc (since it is an example of JVM smart contracts).    The client commands:  sawtooth  poet  intkey  jvmsc  xo  noop    The validator components will be prefixed with 'sawtooth-':    sawtooth-validator  sawtooth-rest-api    Transaction processors will be renamed to conform to the general  format of <family>-tp[-<lang>]. This organization is intended to  sort the CLI commands by family instead of function. The commands  become:    intkey-tp-go  intkey-tp-java  intkey-tp-javascript  intkey-tp-python  jvmsc-tp  xo-tp-go  xo-tp-javascript  xo-tp-python  noop-tp-go  supplychain-tp  poet-validator-registry-tp""","",0,0,1,0,0,0,0,0,0,0,0,1,0,0,0,0,0,0,0,0,0,0,0,0,0,0,0,0,0,0
"STL-541","07/07/2017 14:47:09",2,"Remove MustEncode() and MustDecode() from Go SDK ""Remove the MustEncode() and MustDecode() methods from the Go SDK and replace all calls with hex.EncodeToString() and hex.DecodeString() from the """"encoding/hex"""" Go library. These methods cause panics instead of handling errors gracefully, which is no longer desired. Handle the error returned from DecodeString().     ""","",0,0,1,0,0,1,0,0,0,0,0,0,0,0,0,0,0,0,0,0,0,0,0,0,1,0,0,0,0,0
"STL-542","07/07/2017 14:53:07",2,"Add option to wait for transactions to commit in Burrow-EVM client ""The Burrow-EVM client only checks that transactions were accepted by the REST API. It does not check to see if the transaction was committed or what the error was. An argument should be added to client methods which, if set, will cause the client to block until:   1. A timeout has been reached, at which point it should return and error   2. The transaction has been committed, at which point it should return normally   3. There was a problem committing the transaction, at which point it should return a useful error    Update the integration tests to use this feature once implemented.""","",0,0,1,0,0,0,0,0,0,0,0,0,0,0,0,0,0,0,0,0,0,0,0,0,1,0,0,0,0,0
"STL-543","07/07/2017 14:55:20",2,"Add --wait flag to seth commands ""Add a --wait flag to seth commands that submit transactions which sets the wait option for the client.""","",0,0,1,0,0,0,0,0,0,0,0,0,0,0,0,0,0,0,0,0,0,0,0,0,1,0,0,0,0,0
"STL-545","07/07/2017 16:40:59",2,"Write Transaction Family Specification for Benchmark ""Write the transaction family specification for the benchmark workload selected for benchmarking activity. ""","",0,0,1,0,0,0,0,0,0,0,0,1,0,0,0,0,0,0,0,0,0,0,0,0,0,0,0,0,0,0
"STL-546","07/07/2017 16:41:16",5,"Implement benchmark Transaction Processor & Workload client  ""Based on the transaction family specification, implement benchmark transaction processor. Also implement a command-line client workload generator capable of generating and submitting workload consistent with the design intent of the benchmark.""","",0,0,1,0,0,0,0,0,0,0,0,1,0,0,0,0,0,0,0,0,0,0,0,0,0,0,0,0,0,0
"STL-554","07/07/2017 16:58:54",5,"Design domain specific transaction submission endpoint with server side signing ""Provide the design for an endpoint which can:    * Accept domain-specific transaction content.  For example, this could be submitted in JSON.  * Create a transaction body and batch for submission  * Sign the transaction using server-side stored keys.    The design is open to method on how these keys are associated with the submitter.  Most likely, this will also require one or more authentication endpoints.""","",0,0,1,0,0,0,0,0,0,0,0,1,0,0,0,0,0,0,0,0,0,0,0,0,0,0,0,0,0,0
"STL-563","07/07/2017 19:48:35",3,"Design Burrow-EVM event subscriptions for Solidity events ""Output is a professional design doc describing how to use Sawtooth events to support Solidity events.""","",0,0,1,0,0,0,0,0,0,0,0,0,0,0,0,0,0,0,0,0,0,0,0,0,1,0,0,0,0,0
"STL-564","07/07/2017 19:50:38",3,"Research and document non-standard RPC calls to support ""Output is a list of additional RPC calls added to the JSON-RPC design doc""","",0,0,1,0,0,0,0,0,0,0,0,0,0,0,0,0,0,0,0,0,0,0,0,0,1,0,0,0,0,0
"STL-565","07/07/2017 19:56:03",3,"Design private key storage security for seth/RPC accounts ""Both seth and the JSON-RPC depend on storing private keys to sign transactions. These keys are stored as plaintext. Encryption should be used to store these keys more securely.    Output is a design doc that describes how keys will be secured.""","",0,0,1,0,0,0,0,0,0,0,0,0,0,0,0,0,0,0,0,0,0,0,0,0,1,0,0,0,0,0
"STL-566","07/07/2017 19:56:54",3,"Implement key storage security for seth ""The extent of the design described in milestone 2 is probably too broad for the time allowed to complete this task in Q3 plan. A simpler version should be implemented here, or the task should be moved to Q4 and given an appropriate amount of time to complete it.""","",0,0,1,0,0,0,0,0,0,0,0,0,0,0,0,0,0,0,0,0,0,0,0,0,1,0,0,0,0,0
"STL-571","07/07/2017 20:03:29",0,"Implement Sawtooth generic transaction receipts and events per design ""Decomposed""","",0,0,1,0,0,0,0,0,0,0,0,0,0,0,0,0,0,0,0,0,0,0,0,0,1,0,0,0,0,0
"STL-573","07/07/2017 20:04:57",3,"Update seth to use JSON-RPC or REST-API ""The seth client currently interacts with the REST API. With the creation of the seth-rpc server, it would be nice to add support to the seth client for interacting with the seth-rpc server.""","",0,0,1,0,0,0,0,0,0,0,0,0,0,0,0,0,0,0,0,0,0,0,0,0,1,0,0,0,0,0
"STL-578","07/07/2017 20:23:14",2,"remove wif transcoding  ""# transparently change the internal representation so it loads wif but thereafter remains native.  or   # remove wif entirely and store raw hex to disk.   or   # Change the import/export to default to pem.""","",0,0,1,0,1,0,0,0,0,0,0,0,0,0,0,0,0,0,0,0,0,0,0,0,0,0,0,0,0,0
"STL-579","07/07/2017 20:50:23",3,"Update the SerialScheduler to fail-fast on a batch ""No transactions after the first failed txn in a batch need to be run, so the subsequent txns should be marked as neither valid or invalid, but should not be run.""","",0,0,1,0,0,0,0,0,0,0,0,0,1,0,0,0,0,0,0,0,0,0,0,0,0,0,0,0,0,0
"STL-580","07/07/2017 20:53:20",3,"Merge parallel-scheduler branch into master branch ""Deal with merge conflicts during the process of getting the parallel-scheduler branch merged into master.""","",0,0,1,0,0,0,0,0,0,0,0,0,1,0,0,0,0,0,0,0,0,0,0,0,0,0,0,0,0,0
"STL-581","07/07/2017 20:57:14",3,"Update the SerialScheduler to handle explicit dependencies ""After an explicit dependency fails, the scheduler should mark transactions that listed this txn as a dependency as failed, also.""","",0,0,1,0,0,0,0,0,0,0,0,0,1,0,0,0,0,0,0,0,0,0,0,0,0,0,0,0,0,0
"STL-603","07/11/2017 18:26:01",3,"Update sdks' State classes to have a delete method ""Each sdk needs to support deletes from state. The form, similar to gets and sets, should be .delete([add1, add2, add3]).         Needs to be added to Go and Javascript at the least. ""","",0,0,1,0,0,1,0,0,0,0,0,0,0,0,0,1,1,0,0,0,0,0,0,0,0,1,0,0,1,0
"STL-610","07/18/2017 22:27:22",1,"Update validator registry handler to use state delete method ""[https://github.com/hyperledger/sawtooth-core/blob/master/consensus/poet/families/sawtooth_validator_registry/validator_registry/processor/handler.py#L133]    Clears state at specified address.     Instead, make use of new state delete feature. Anticipated in     [https://github.com/hyperledger/sawtooth-core/pull/718]     ""","",0,0,1,0,0,0,0,0,0,0,0,0,0,0,0,0,0,1,0,0,0,0,0,0,0,0,0,0,0,0
"STL-612","07/24/2017 18:55:55",3,"Update HL overview deck ""Update/Finalize Hyperledger's Slide deck on Sawtooth""","",1,0,0,0,0,0,0,0,1,0,0,0,0,0,0,0,0,0,0,0,0,0,0,0,0,0,0,0,0,0
"STL-629","08/07/2017 15:18:01",2,"Migrate docs to hyperledger.org from legacy URL ""[~amundson] has new URL and process in mind.""","",0,0,1,0,0,0,0,0,1,0,0,0,0,0,0,0,0,0,0,0,0,0,0,0,0,0,0,0,0,0
"STL-670","09/08/2017 16:42:30",0,"Change default REST API port to 8008 ""Currently the Sawtooth REST API defaults to `localhost:8080`, which is common enough that it is likely to conflict with many web services developers may be running. This default should be changed to `localhost:8008`, which is less likely to cause collisions, is still a common HTTP port, and happens to be exactly twice the validator's default port.    This task includes changing _every_ default in sawtooth-core which expects to find the REST API at `localhost:8080`. This will include many CLIs and possible some other components as well.""","",0,0,1,0,0,0,0,1,0,0,0,0,0,0,1,0,0,0,0,0,0,0,1,0,0,0,0,0,0,0
"STL-807","10/25/2017 20:08:30",3,"Add unschedule_incomplete_batches() to Scheduler ""In order to create blocks when the consensus module deems a node to have """"won the block"""", the scheduler needs to discard any unprocessed batches.  Otherwise, the remaining batches' processing time may extend past the window of opportunity for claiming the block.    Add a {{scheduler.unschedule_incomplete_batches()}} function, which takes any uncompleted transactions and removes them from the schedule.    The flow should be:     ""","  scheduler.unschedule_incomplete_batches()  scheduler.finalize()  scheduler.complete(block=True)",1,0,0,0,0,0,0,0,0,0,0,0,1,0,0,0,0,0,0,1,0,0,0,0,0,0,0,0,0,0
"STL-858","11/16/2017 21:54:52",1,"Wait option on sawtooth batch submit CLI fails ""batch submit works fine for this batch but adding the --wait option throws a stack trace.         sawtooth batch submit -f poet-settings.batch --url http://rest-api:8080 --wait    batches: 1,  batch/sec: 53.31448691385644    Traceback (most recent call last):(      File """"/project/sawtooth-core/cli/sawtooth_cli/main.py"""", line 160, in main_wrapper        main()      File """"/project/sawtooth-core/cli/sawtooth_cli/main.py"""", line 144, in main        do_batch(args)      File """"/project/sawtooth-core/cli/sawtooth_cli/batch.py"""", line 152, in do_batch        do_batch_submit(args)      File """"/project/sawtooth-core/cli/sawtooth_cli/batch.py"""", line 275, in do_batch_submit        if all(s.status == 'COMMITTED' for s in statuses):      File """"/project/sawtooth-core/cli/sawtooth_cli/batch.py"""", line 275, in <genexpr>        if all(s.status == 'COMMITTED' for s in statuses):    AttributeError: 'dict' object has no attribute 'status'""","",0,1,0,0,0,0,0,0,0,0,0,0,0,0,0,0,0,0,0,0,0,0,1,0,0,0,0,0,0,0
"STL-905","11/29/2017 19:08:48",2,"Relax PoET registration freshness requirement ""Validator registration requires a nonce referencing the latest block.    That is overly restrictive. The freshness goal is to make it unlikely that a validator was revoked from the EPID group at the time of registration.    Something on the order of 10 blocks should still be more than sufficient.    The current harm from the 1 block requirement is that it's very likely that a validator's signup will fail in proportion to the load on the network. i.e. the signup transaction can't be guaranteed to commit within 1 block of the validator creating the registration transaction.         Update code and Spec.""","",0,0,1,0,0,0,0,0,0,0,0,0,0,0,0,0,0,1,0,0,0,0,0,0,0,0,0,0,0,0
"STL-967","01/03/2018 21:23:00",2,"Add logging guidelines to Contributor's Guide ""Should also include reaching consensus on these guidelines""","",0,0,1,0,0,0,0,0,1,0,0,0,0,0,0,0,0,0,0,0,0,0,0,0,0,0,0,0,0,0
"STL-968","01/03/2018 21:25:00",3,"Remove batches from block before broadcast after publishing ""Remove batches from block (excluding injected batches) before broadcast after publishing""","",1,0,0,0,0,0,0,0,0,0,0,0,0,0,0,0,0,0,0,1,0,0,0,1,0,0,0,0,0,0
"STL-969","01/03/2018 21:25:54",1,"Add metric for rate of rejected batches due to back pressure ""* batches rejected per node (count)   * batches rejected per node (gauge)""","",1,0,0,0,0,0,0,0,0,0,0,0,0,0,0,0,0,0,0,0,0,0,0,1,0,0,0,0,0,0
"STL-970","01/03/2018 21:39:28",3,"Implement command to prune the block store from a given block. ""Example: {{sawadm prune <block-id>}}""","",1,0,0,0,0,0,0,0,0,0,0,0,0,0,0,0,0,0,0,0,0,0,1,0,0,0,0,0,0,0
"STL-994","01/13/2018 23:54:06",1,"Log full batch and transaction ids instead of truncating ""Example of a bad message that truncates the batch id:    Jan  9 11:11:13 ec2-184-72-66-148.compute-1.amazonaws.com [psimlr7-node7]    DEBUG                     Thread-54                        chain Invalid batch f6fae4cf encountered during verification of block 52bdda9387194b6e71e25a07bfe1a8f59154a07ef959dc1531ce7ecef4d81f031799d610b227c4c0b610e952a379b4ee2f37acd5a436be1b61abf0562b53a2f9 (block_num:55, state:5aee65406b9ac2f442fb710bbd58f9148489359f8378b90c6d670768828e5beb, previous_block_id:83de41121c8801ec4bfd5228ece9c9cb2ed0c63fb871aae721ad7554fe747121615f09a9ce2344701945bb47b4f541453d9fc38c9475b4194b43ffc89e708925)""","",0,0,1,0,0,0,0,0,0,0,0,0,0,0,0,0,0,0,0,1,0,0,0,0,0,0,0,0,0,0
"STL-1013","01/18/2018 02:08:23",2,"Add QUEUE_FULL response type to transaction processor messages ""This should add a new message protos and add support to the validator for handling this type of message.""","",1,0,0,0,0,0,0,0,0,0,0,0,1,0,0,0,0,0,0,0,0,0,0,0,0,0,0,0,0,0
"STL-1036","01/31/2018 22:14:00",1,"Add in-process transactions metric ""Add a metric to the executor to track the number of transactions that have been sent to a transaction processor and are awaiting a transaction response. This should be incremented whenever a new transaction process request is submitted and decremented whenever a response is received.""","",0,0,1,0,0,0,0,0,0,0,0,0,1,0,0,0,0,0,0,0,0,0,0,0,0,0,0,0,0,0
"STL-1037","01/31/2018 22:17:27",1,"Log at error level when an INTERNAL_ERROR is returned from a transaction processor  ""The executor should log whenever a transaction processor sends a TpProcessResponse with status INTERNAL_ERROR. This should be logged at the ERROR level. Additional information about the transaction should also be logged for diagnosis.""","",0,0,1,0,0,0,0,0,0,0,0,0,1,0,0,0,0,0,0,0,0,0,0,0,0,0,0,0,0,0
"STL-1076","02/23/2018 18:12:20",2,"XO Family specification missing delete operation; clarify name fields; fix range ""Defect in version 1.0.1    The XO Transaction family specification should include the transaction action `delete`    The `name` field of the transactions and the state element should indicate that is the name of the game and that is how the record is keyed. The implication being that all game names must be unique     The range of values for a `space` should be [1,9] inclusive.""","",0,1,0,0,0,0,0,1,1,0,0,0,0,0,0,0,0,0,0,0,0,0,0,0,0,0,0,0,0,0
"STL-1119","03/13/2018 16:18:28",1,"sawtooth-rest-api CLI has old URL in --help text  ""{{}}Wrong:         -B BIND, --bind BIND identify host and port for API to run on default: http://localhost:8080)    Should be:         ... (default: http://localhost:8008)""","",0,1,0,0,0,0,0,0,0,0,0,0,0,0,0,0,0,0,0,0,0,0,1,0,0,0,0,0,0,0
"STL-1122","03/20/2018 15:56:05",1,"Wrong default URL (8800) in example validator config file ""The file sawtooth-core/validator/packaging/validator.toml.example has the wrong default URL. Currently:     {{     bind = [}}  {{     """"network:tcp://127.0.0.1:8800"""",}}  {{     """"component:tcp://127.0.0.1:4004""""}}  {{     ]}}    Should be:     {{     bind = [}}  {{     """"network:tcp://127.0.0.1:8008"""",}}  {{     """"component:tcp://127.0.0.1:4004""""}}  {{     ]}}""","",0,1,0,0,0,0,0,0,0,0,0,1,0,0,0,0,0,0,0,0,0,0,0,0,0,0,0,0,0,0
"STL-1165","04/12/2018 18:20:19",3,"App Dev Docs for Transaction Processors is out of date ""The Transaction Processor tutorials for both Python and Javascript (unsure about Java), use the 0.8 API for instantiating the TransactionHandler. They erroneously include encoding, which is no longer used, and for JS, list family versions as a string. It should be an array.    [https://sawtooth.hyperledger.org/docs/core/releases/latest/_autogen/sdk_TP_tutorial_js.html#the-xohandler-class]  [https://sawtooth.hyperledger.org/docs/core/releases/latest/_autogen/sdk_TP_tutorial_python.html#the-xotransactionhandler-class]    Might be worth give the rest of the document a once over for other 0.8 syntax as well.""","",0,1,0,0,0,0,0,0,1,0,0,0,0,0,0,0,0,0,0,0,0,0,0,0,0,0,0,0,0,0
"STL-1243","05/16/2018 22:24:03",1,"Improve consistency of SDK Documentation cover page ""On the SDK API cover page (link below) the python sections are labeled """"processor package"""" and """"sawtooth_signing"""" package, and each has lots of sub-bullets, while the other SDK sections are labeled """"Transaction Processor"""" and """"Signing"""" and have no sub-bullets.    Recommendation is to name sections consistently - it is difficult to tell what the different formats mean, e.g. whether the Python SDK is different from the other two in some important way.    [https://sawtooth.hyperledger.org/docs/core/releases/1.0/sdks.html]     ""","",0,0,1,0,0,0,0,0,1,0,0,0,0,0,0,0,0,0,0,0,0,0,0,0,0,0,0,0,0,0
"STL-1303","06/13/2018 21:13:24",3,"Missing information: Setting on-chain permissions for a transaction family ""Restore the 1.0.4 information in """"Configuring the List of Transaction Families"""":   [https://sawtooth.hyperledger.org/docs/core/releases/latest/app_developers_guide/docker.html#configuring-the-list-of-transaction-families]    The SysAdmin guide probably needs an expanded version of this information.     ""","",0,1,0,0,0,0,0,0,1,0,0,0,0,0,0,0,0,0,0,0,0,0,0,0,0,0,0,0,0,0
"STL-1306","06/14/2018 21:19:49",2,"Document the process for generating the Curve ZMQ key pair ""Add details on how to generate a new key pair for the Curve ZMQ to ensure network encryption.""","",0,0,1,0,0,0,0,0,1,0,0,0,0,0,0,0,0,0,0,0,0,0,0,0,0,0,0,0,0,0
"STL-1350","07/12/2018 20:34:15",1,"Correct ""Transactions and Batches"" diagram ""Update with the current contents of protos/batch.proto and protos/transaction.proto.""","",0,0,1,0,0,0,0,0,1,0,0,0,0,0,0,0,0,0,0,0,0,0,0,0,0,0,0,0,0,0
"STL-1351","07/12/2018 21:05:29",5,"SUPERSEDED: Document consensus API - new arch doc & engine steps ""Describe the new consensus API and consensus engines.   * Write a new Consensus Interface section for the Architecture Guide   * Update the consensus-related steps in the Application Developer's Guide and System Administrator's Guide.     Source information:   * Hyperledger blog post: [https://www.hyperledger.org/blog/2018/05/24/one-year-later-interoperability-standardization-shine-at-consensus]    * Adam Ludvik's presentation, """"Sawtooth Consensus engines"""" (for AMS hackathon 2018)   * Consensus RFC: [https://github.com/hyperledger/sawtooth-rfcs/pull/4] ""","",0,0,1,0,0,0,0,0,1,0,0,0,0,0,0,0,0,0,0,0,0,0,0,0,0,0,0,0,0,0
"STL-1352","07/12/2018 23:02:41",3,"Fix Journal section: Redo intro, delete obsolete content ""This includes deleting the Journal chapter itself.  The remaining (valid) sections will be reorganized and possibly retitled (covered in a separate story).""","",0,0,1,0,0,0,0,0,1,0,0,0,0,0,0,0,0,0,0,0,0,0,0,0,0,0,0,0,0,0
"STL-1362","07/18/2018 23:46:24",1,"Update ""Sawtooth Architecture"" picture with consensus changes ""The consensus changes (consensus engine and proxy) affect this Sawtooth architecture picture: https://sawtooth.hyperledger.org/docs/core/nightly/master/_images/arch-sawtooth-overview.svg""","",0,0,1,0,0,0,0,0,1,0,0,0,0,0,0,0,0,0,0,0,0,0,0,0,0,0,0,0,0,0
"STL-1364","07/23/2018 23:09:20",1,"Fix title of ""Genesis Operation"" ""Change to """"The Genesis Process"""" (the word """"operation"""" is confusing).""","",0,0,1,0,0,0,0,0,1,0,0,0,0,0,0,0,0,0,0,0,0,0,0,0,0,0,0,0,0,0
"STL-1414","09/04/2018 22:21:00",5,"Gather changes for Sys Admin Guide update ""Work with sysadmin experts to identify errors, out-of-date information, and areas of confusion in the current System Administrator's Guide.""","",0,0,1,0,0,0,0,0,1,0,0,0,0,0,0,0,0,0,0,0,0,0,0,0,0,0,0,0,0,0
"STL-1415","09/04/2018 22:28:13",1,"Compare SGX and non-SGX procedures in Sys Admin Guide ""Work with sysadmin and Sawtooth experts to determine which steps in the SGX procedure are valid for a non-SGX Sawtooth node.""","",0,0,1,0,0,0,0,0,1,0,0,0,0,0,0,0,0,0,0,0,0,0,0,0,0,0,0,0,0,0
"STL-1433","09/13/2018 16:44:13",1,"Clarify Apache setup proc in 'Using a Proxy Server [for] REST API' ""Edit content to clarify information.         Note: The technical updates are covered in STL-1447:   * Change paths from `/tmp` to a less temporary location.   * For password-file-creation step, explain how the password is hashed.   * For `openssl` step, add a link to `letsencrypt.org`.   * Change Apache and Sawtooth component startup steps to use `systemctl`.     ""","",0,0,1,0,0,0,0,0,1,0,0,0,0,0,0,0,0,0,0,0,0,0,0,0,0,0,0,0,0,0
"STL-1434","09/13/2018 16:59:20",3,"Update config steps for non-SGX proc in Sys Admin Guide ""Determine the necessary config steps (based on the ref info config section) and add them to the SGX and non-SGX procedures.    Rework the existing """"Configuring Sawtooth"""" section to clarify that it's reference information; move it to the end of the chapter.""","",0,0,1,0,0,0,0,0,1,0,0,0,0,0,0,0,0,0,0,0,0,0,0,0,0,0,0,0,0,0
"STL-1435","09/13/2018 17:05:27",1,"Add new consensus steps to SGX + non-SGX procedures ""* Download and install consensus engine(s)   * Configure consensus in validator config file (new bind options)   * Start consensus engine with other Sawtooth components     ""","",0,0,1,0,0,0,0,0,1,0,0,0,0,0,0,0,0,0,0,0,0,0,0,0,0,0,0,0,0,0
"STL-1436","09/13/2018 18:30:47",1,"Determine how to handle SGX procedure in Sys Admin Guide ""Research the existence (or lack) of a consensus engine for PoET SGX and update or remove the SGX procedure accordingly.""","",0,0,1,0,0,0,0,0,1,0,0,0,0,0,0,0,0,0,0,0,0,0,0,0,0,0,0,0,0,0
"STL-1443","09/14/2018 00:33:02",5,"Correct + reorg non-SGX install/config proc in Sys Admin Guide ""Collect the existing (separate) sections into one procedure.    Reorganize into the correct order.    Add missing steps: Generating keys, configuring services, etc. (Other JIRAs cover the missing steps for Sawtooth config and new consensus engine info.)""","",0,0,1,0,0,0,0,0,1,0,0,0,0,0,0,0,0,0,0,0,0,0,0,0,0,0,0,0,0,0
"STL-1459","09/27/2018 09:09:27",1,"Update config steps for SGX proc in Sys Admin Guide ""Make changes discovered in STL-1434.""","",0,0,1,0,0,0,0,0,1,0,0,0,0,0,0,0,0,0,0,0,0,0,0,0,0,0,0,0,0,0
"STL-1530","04/29/2019 10:33:14",1,"poet-sgx use the version 2 of remote attestation protocol which is not supported anymore by Intel ""In the poet-sgx consensus, during the remote attestation protocol, the requests for get_signature_revocation_lists and post_verify_attestation are made for the v2 of the attestation protocol, which is not supported anymore. A simple fix is to change the path by v3 in order to use the correct version.""","",0,1,0,0,0,0,0,0,0,0,0,0,0,0,0,0,0,1,0,0,0,0,0,0,0,0,0,0,0,1
